1768082528.822801 IP 127.0.0.1.52558 > 127.0.0.1.31337: Flags [S], seq 741101939, win 65535, options [mss 16344,nop,wscale 6,nop,nop,TS val 2894215653 ecr 0,sackOK,eol], length 0
1768082528.822827 IP 127.0.0.1.31337 > 127.0.0.1.52558: Flags [R.], seq 0, ack 741101940, win 0, length 0
1768082581.223630 IP 127.0.0.1.52560 > 127.0.0.1.31337: Flags [S], seq 3232442246, win 65535, options [mss 16344,nop,wscale 6,nop,nop,TS val 3724495812 ecr 0,sackOK,eol], length 0
1768082581.223725 IP 127.0.0.1.31337 > 127.0.0.1.52560: Flags [S.], seq 3351718520, ack 3232442247, win 65535, options [mss 16344,nop,wscale 6,nop,nop,TS val 3455743022 ecr 3724495812,sackOK,eol], length 0
1768082581.223748 IP 127.0.0.1.52560 > 127.0.0.1.31337: Flags [.], ack 1, win 6380, options [nop,nop,TS val 3724495812 ecr 3455743022], length 0
1768082581.223764 IP 127.0.0.1.52560 > 127.0.0.1.31337: Flags [F.], seq 1, ack 1, win 6380, options [nop,nop,TS val 3724495812 ecr 3455743022], length 0
1768082581.223768 IP 127.0.0.1.31337 > 127.0.0.1.52560: Flags [.], ack 1, win 6380, options [nop,nop,TS val 3455743022 ecr 3724495812], length 0
1768082581.223778 IP 127.0.0.1.31337 > 127.0.0.1.52560: Flags [.], ack 2, win 6380, options [nop,nop,TS val 3455743022 ecr 3724495812], length 0
1768082581.822433 IP 127.0.0.1.52561 > 127.0.0.1.31337: Flags [S], seq 3658539491, win 65535, options [mss 16344,nop,wscale 6,nop,nop,TS val 1596788638 ecr 0,sackOK,eol], length 0
1768082581.822493 IP 127.0.0.1.31337 > 127.0.0.1.52561: Flags [S.], seq 1318607070, ack 3658539492, win 65535, options [mss 16344,nop,wscale 6,nop,nop,TS val 374780755 ecr 1596788638,sackOK,eol], length 0
1768082581.822503 IP 127.0.0.1.52561 > 127.0.0.1.31337: Flags [.], ack 1, win 6380, options [nop,nop,TS val 1596788638 ecr 374780755], length 0
1768082581.822512 IP 127.0.0.1.31337 > 127.0.0.1.52561: Flags [.], ack 1, win 6380, options [nop,nop,TS val 374780755 ecr 1596788638], length 0
1768082581.822563 IP 127.0.0.1.52561 > 127.0.0.1.31337: Flags [P.], seq 1:5, ack 1, win 6380, options [nop,nop,TS val 1596788638 ecr 374780755], length 4
1768082581.822569 IP 127.0.0.1.52561 > 127.0.0.1.31337: Flags [P.], seq 5:18, ack 1, win 6380, options [nop,nop,TS val 1596788638 ecr 374780755], length 13
1768082581.822578 IP 127.0.0.1.31337 > 127.0.0.1.52561: Flags [.], ack 5, win 6380, options [nop,nop,TS val 374780755 ecr 1596788638], length 0
1768082581.822581 IP 127.0.0.1.31337 > 127.0.0.1.52561: Flags [.], ack 18, win 6380, options [nop,nop,TS val 374780755 ecr 1596788638], length 0
1768082581.978815 IP 127.0.0.1.31337 > 127.0.0.1.52561: Flags [P.], seq 1:12, ack 18, win 6380, options [nop,nop,TS val 374780911 ecr 1596788638], length 11
1768082581.978878 IP 127.0.0.1.52561 > 127.0.0.1.31337: Flags [.], ack 12, win 6380, options [nop,nop,TS val 1596788794 ecr 374780911], length 0
1768082581.978925 IP 127.0.0.1.52561 > 127.0.0.1.31337: Flags [P.], seq 18:22, ack 12, win 6380, options [nop,nop,TS val 1596788795 ecr 374780911], length 4
1768082581.978931 IP 127.0.0.1.52561 > 127.0.0.1.31337: Flags [P.], seq 22:35, ack 12, win 6380, options [nop,nop,TS val 1596788795 ecr 374780911], length 13
1768082581.978951 IP 127.0.0.1.31337 > 127.0.0.1.52561: Flags [.], ack 22, win 6380, options [nop,nop,TS val 374780912 ecr 1596788795], length 0
1768082581.978964 IP 127.0.0.1.31337 > 127.0.0.1.52561: Flags [.], ack 35, win 6380, options [nop,nop,TS val 374780912 ecr 1596788795], length 0
1768082582.046094 IP 127.0.0.1.31337 > 127.0.0.1.52561: Flags [P.], seq 12:36, ack 35, win 6380, options [nop,nop,TS val 374780979 ecr 1596788795], length 24
1768082582.046168 IP 127.0.0.1.52561 > 127.0.0.1.31337: Flags [.], ack 36, win 6380, options [nop,nop,TS val 1596788862 ecr 374780979], length 0
1768082582.046326 IP 127.0.0.1.52561 > 127.0.0.1.31337: Flags [P.], seq 35:39, ack 36, win 6380, options [nop,nop,TS val 1596788862 ecr 374780979], length 4
1768082582.046332 IP 127.0.0.1.52561 > 127.0.0.1.31337: Flags [P.], seq 39:58, ack 36, win 6380, options [nop,nop,TS val 1596788862 ecr 374780979], length 19
1768082582.046351 IP 127.0.0.1.31337 > 127.0.0.1.52561: Flags [.], ack 39, win 6380, options [nop,nop,TS val 374780979 ecr 1596788862], length 0
1768082582.046364 IP 127.0.0.1.31337 > 127.0.0.1.52561: Flags [.], ack 58, win 6380, options [nop,nop,TS val 374780979 ecr 1596788862], length 0
1768082582.140480 IP 127.0.0.1.31337 > 127.0.0.1.52561: Flags [P.], seq 36:859, ack 58, win 6380, options [nop,nop,TS val 374781073 ecr 1596788862], length 823
1768082582.140543 IP 127.0.0.1.52561 > 127.0.0.1.31337: Flags [.], ack 859, win 6368, options [nop,nop,TS val 1596788956 ecr 374781073], length 0
1768082582.392034 IP 127.0.0.1.52561 > 127.0.0.1.31337: Flags [P.], seq 58:62, ack 859, win 6368, options [nop,nop,TS val 1596789208 ecr 374781073], length 4
1768082582.392049 IP 127.0.0.1.52561 > 127.0.0.1.31337: Flags [P.], seq 62:66, ack 859, win 6368, options [nop,nop,TS val 1596789208 ecr 374781073], length 4
1768082582.392099 IP 127.0.0.1.31337 > 127.0.0.1.52561: Flags [.], ack 62, win 6380, options [nop,nop,TS val 374781325 ecr 1596789208], length 0
1768082582.392118 IP 127.0.0.1.31337 > 127.0.0.1.52561: Flags [.], ack 66, win 6380, options [nop,nop,TS val 374781325 ecr 1596789208], length 0
1768082582.472624 IP 127.0.0.1.31337 > 127.0.0.1.52561: Flags [P.], seq 859:870, ack 66, win 6380, options [nop,nop,TS val 374781405 ecr 1596789208], length 11
1768082582.472694 IP 127.0.0.1.52561 > 127.0.0.1.31337: Flags [.], ack 870, win 6368, options [nop,nop,TS val 1596789288 ecr 374781405], length 0
1768082582.472766 IP 127.0.0.1.52561 > 127.0.0.1.31337: Flags [F.], seq 66, ack 870, win 6368, options [nop,nop,TS val 1596789288 ecr 374781405], length 0
1768082582.472799 IP 127.0.0.1.31337 > 127.0.0.1.52561: Flags [.], ack 67, win 6380, options [nop,nop,TS val 374781405 ecr 1596789288], length 0
1768082582.553843 IP 127.0.0.1.52562 > 127.0.0.1.31337: Flags [S], seq 2291396275, win 65535, options [mss 16344,nop,wscale 6,nop,nop,TS val 1008543643 ecr 0,sackOK,eol], length 0
1768082582.553931 IP 127.0.0.1.31337 > 127.0.0.1.52562: Flags [S.], seq 4164428374, ack 2291396276, win 65535, options [mss 16344,nop,wscale 6,nop,nop,TS val 3199617543 ecr 1008543643,sackOK,eol], length 0
1768082582.553950 IP 127.0.0.1.52562 > 127.0.0.1.31337: Flags [.], ack 1, win 6380, options [nop,nop,TS val 1008543644 ecr 3199617543], length 0
1768082582.553966 IP 127.0.0.1.31337 > 127.0.0.1.52562: Flags [.], ack 1, win 6380, options [nop,nop,TS val 3199617544 ecr 1008543644], length 0
1768082582.554030 IP 127.0.0.1.52562 > 127.0.0.1.31337: Flags [P.], seq 1:5, ack 1, win 6380, options [nop,nop,TS val 1008543644 ecr 3199617544], length 4
1768082582.554036 IP 127.0.0.1.52562 > 127.0.0.1.31337: Flags [P.], seq 5:18, ack 1, win 6380, options [nop,nop,TS val 1008543644 ecr 3199617544], length 13
1768082582.554061 IP 127.0.0.1.31337 > 127.0.0.1.52562: Flags [.], ack 5, win 6380, options [nop,nop,TS val 3199617544 ecr 1008543644], length 0
1768082582.554069 IP 127.0.0.1.31337 > 127.0.0.1.52562: Flags [.], ack 18, win 6380, options [nop,nop,TS val 3199617544 ecr 1008543644], length 0
1768082582.689656 IP 127.0.0.1.31337 > 127.0.0.1.52562: Flags [P.], seq 1:12, ack 18, win 6380, options [nop,nop,TS val 3199617679 ecr 1008543644], length 11
1768082582.689710 IP 127.0.0.1.52562 > 127.0.0.1.31337: Flags [.], ack 12, win 6380, options [nop,nop,TS val 1008543779 ecr 3199617679], length 0
1768082582.689755 IP 127.0.0.1.52562 > 127.0.0.1.31337: Flags [P.], seq 18:22, ack 12, win 6380, options [nop,nop,TS val 1008543779 ecr 3199617679], length 4
1768082582.689763 IP 127.0.0.1.52562 > 127.0.0.1.31337: Flags [P.], seq 22:35, ack 12, win 6380, options [nop,nop,TS val 1008543779 ecr 3199617679], length 13
1768082582.689779 IP 127.0.0.1.31337 > 127.0.0.1.52562: Flags [.], ack 22, win 6380, options [nop,nop,TS val 3199617679 ecr 1008543779], length 0
1768082582.689790 IP 127.0.0.1.31337 > 127.0.0.1.52562: Flags [.], ack 35, win 6380, options [nop,nop,TS val 3199617679 ecr 1008543779], length 0
1768082582.756370 IP 127.0.0.1.31337 > 127.0.0.1.52562: Flags [P.], seq 12:36, ack 35, win 6380, options [nop,nop,TS val 3199617746 ecr 1008543779], length 24
1768082582.756432 IP 127.0.0.1.52562 > 127.0.0.1.31337: Flags [.], ack 36, win 6380, options [nop,nop,TS val 1008543846 ecr 3199617746], length 0
1768082582.756572 IP 127.0.0.1.52562 > 127.0.0.1.31337: Flags [P.], seq 35:39, ack 36, win 6380, options [nop,nop,TS val 1008543846 ecr 3199617746], length 4
1768082582.756579 IP 127.0.0.1.52562 > 127.0.0.1.31337: Flags [P.], seq 39:66, ack 36, win 6380, options [nop,nop,TS val 1008543846 ecr 3199617746], length 27
1768082582.756596 IP 127.0.0.1.31337 > 127.0.0.1.52562: Flags [.], ack 39, win 6380, options [nop,nop,TS val 3199617746 ecr 1008543846], length 0
1768082582.756609 IP 127.0.0.1.31337 > 127.0.0.1.52562: Flags [.], ack 66, win 6380, options [nop,nop,TS val 3199617746 ecr 1008543846], length 0
1768082582.820192 IP 127.0.0.1.31337 > 127.0.0.1.52562: Flags [P.], seq 36:75, ack 66, win 6380, options [nop,nop,TS val 3199617810 ecr 1008543846], length 39
1768082582.820256 IP 127.0.0.1.52562 > 127.0.0.1.31337: Flags [.], ack 75, win 6380, options [nop,nop,TS val 1008543910 ecr 3199617810], length 0
1768082582.820346 IP 127.0.0.1.52562 > 127.0.0.1.31337: Flags [P.], seq 66:70, ack 75, win 6380, options [nop,nop,TS val 1008543910 ecr 3199617810], length 4
1768082582.820352 IP 127.0.0.1.52562 > 127.0.0.1.31337: Flags [P.], seq 70:97, ack 75, win 6380, options [nop,nop,TS val 1008543910 ecr 3199617810], length 27
1768082582.820371 IP 127.0.0.1.31337 > 127.0.0.1.52562: Flags [.], ack 70, win 6380, options [nop,nop,TS val 3199617810 ecr 1008543910], length 0
1768082582.820384 IP 127.0.0.1.31337 > 127.0.0.1.52562: Flags [.], ack 97, win 6380, options [nop,nop,TS val 3199617810 ecr 1008543910], length 0
1768082597.822741 IP 127.0.0.1.52562 > 127.0.0.1.31337: Flags [P.], seq 97:101, ack 75, win 6380, options [nop,nop,TS val 1008558912 ecr 3199617810], length 4
1768082597.822753 IP 127.0.0.1.52562 > 127.0.0.1.31337: Flags [P.], seq 101:105, ack 75, win 6380, options [nop,nop,TS val 1008558912 ecr 3199617810], length 4
1768082597.822806 IP 127.0.0.1.31337 > 127.0.0.1.52562: Flags [.], ack 101, win 6380, options [nop,nop,TS val 3199632812 ecr 1008558912], length 0
1768082597.822824 IP 127.0.0.1.31337 > 127.0.0.1.52562: Flags [.], ack 105, win 6380, options [nop,nop,TS val 3199632812 ecr 1008558912], length 0
1768082641.223469 IP 127.0.0.1.52560 > 127.0.0.1.31337: Flags [R.], seq 2, ack 1, win 6380, length 0
1768082642.761487 IP 127.0.0.1.52561 > 127.0.0.1.31337: Flags [R.], seq 67, ack 870, win 6368, length 0
1768082702.656879 IP 127.0.0.1.31337 > 127.0.0.1.52562: Flags [F.], seq 75, ack 105, win 6380, options [nop,nop,TS val 3199737647 ecr 1008558912], length 0
1768082702.656937 IP 127.0.0.1.52562 > 127.0.0.1.31337: Flags [.], ack 76, win 6380, options [nop,nop,TS val 1008663747 ecr 3199737647], length 0
1768082702.657031 IP 127.0.0.1.52562 > 127.0.0.1.31337: Flags [F.], seq 105, ack 76, win 6380, options [nop,nop,TS val 1008663747 ecr 3199737647], length 0
1768082702.657077 IP 127.0.0.1.31337 > 127.0.0.1.52562: Flags [.], ack 106, win 6380, options [nop,nop,TS val 3199737647 ecr 1008663747], length 0
1768082702.657126 IP 127.0.0.1.52569 > 127.0.0.1.31337: Flags [S], seq 2203141341, win 65535, options [mss 16344,nop,wscale 6,nop,nop,TS val 2770406925 ecr 0,sackOK,eol], length 0
1768082702.657150 IP 127.0.0.1.31337 > 127.0.0.1.52569: Flags [R.], seq 0, ack 2203141342, win 0, length 0
1768082702.861181 IP 127.0.0.1.52570 > 127.0.0.1.31337: Flags [S], seq 3862887277, win 65535, options [mss 16344,nop,wscale 6,nop,nop,TS val 1764927479 ecr 0,sackOK,eol], length 0
1768082702.861210 IP 127.0.0.1.31337 > 127.0.0.1.52570: Flags [R.], seq 0, ack 3862887278, win 0, length 0
1768082703.265814 IP 127.0.0.1.52571 > 127.0.0.1.31337: Flags [S], seq 2795538184, win 65535, options [mss 16344,nop,wscale 6,nop,nop,TS val 1231103435 ecr 0,sackOK,eol], length 0
1768082703.265860 IP 127.0.0.1.31337 > 127.0.0.1.52571: Flags [R.], seq 0, ack 2795538185, win 0, length 0
1768082704.071393 IP 127.0.0.1.52572 > 127.0.0.1.31337: Flags [S], seq 3772991969, win 65535, options [mss 16344,nop,wscale 6,nop,nop,TS val 2876375632 ecr 0,sackOK,eol], length 0
1768082704.071419 IP 127.0.0.1.31337 > 127.0.0.1.52572: Flags [R.], seq 0, ack 3772991970, win 0, length 0
1768083605.962781 IP 127.0.0.1.52651 > 127.0.0.1.31337: Flags [S], seq 983215025, win 65535, options [mss 16344,nop,wscale 6,nop,nop,TS val 1700002797 ecr 0,sackOK,eol], length 0
1768083605.962810 IP 127.0.0.1.31337 > 127.0.0.1.52651: Flags [R.], seq 0, ack 983215026, win 0, length 0
1768083658.433011 IP 127.0.0.1.52653 > 127.0.0.1.31337: Flags [S], seq 1713085315, win 65535, options [mss 16344,nop,wscale 6,nop,nop,TS val 694893620 ecr 0,sackOK,eol], length 0
1768083658.433088 IP 127.0.0.1.31337 > 127.0.0.1.52653: Flags [S.], seq 2209079921, ack 1713085316, win 65535, options [mss 16344,nop,wscale 6,nop,nop,TS val 499634561 ecr 694893620,sackOK,eol], length 0
1768083658.433105 IP 127.0.0.1.52653 > 127.0.0.1.31337: Flags [.], ack 1, win 6380, options [nop,nop,TS val 694893620 ecr 499634561], length 0
1768083658.433119 IP 127.0.0.1.31337 > 127.0.0.1.52653: Flags [.], ack 1, win 6380, options [nop,nop,TS val 499634561 ecr 694893620], length 0
1768083658.433122 IP 127.0.0.1.52653 > 127.0.0.1.31337: Flags [F.], seq 1, ack 1, win 6380, options [nop,nop,TS val 694893620 ecr 499634561], length 0
1768083658.433131 IP 127.0.0.1.31337 > 127.0.0.1.52653: Flags [.], ack 2, win 6380, options [nop,nop,TS val 499634561 ecr 694893620], length 0
1768083658.900613 IP 127.0.0.1.52654 > 127.0.0.1.31337: Flags [S], seq 1637148218, win 65535, options [mss 16344,nop,wscale 6,nop,nop,TS val 3465582798 ecr 0,sackOK,eol], length 0
1768083658.900710 IP 127.0.0.1.31337 > 127.0.0.1.52654: Flags [S.], seq 149974339, ack 1637148219, win 65535, options [mss 16344,nop,wscale 6,nop,nop,TS val 1683170079 ecr 3465582798,sackOK,eol], length 0
1768083658.900727 IP 127.0.0.1.52654 > 127.0.0.1.31337: Flags [.], ack 1, win 6380, options [nop,nop,TS val 3465582799 ecr 1683170079], length 0
1768083658.900741 IP 127.0.0.1.31337 > 127.0.0.1.52654: Flags [.], ack 1, win 6380, options [nop,nop,TS val 1683170079 ecr 3465582799], length 0
1768083658.900813 IP 127.0.0.1.52654 > 127.0.0.1.31337: Flags [P.], seq 1:5, ack 1, win 6380, options [nop,nop,TS val 3465582799 ecr 1683170079], length 4
1768083658.900819 IP 127.0.0.1.52654 > 127.0.0.1.31337: Flags [P.], seq 5:18, ack 1, win 6380, options [nop,nop,TS val 3465582799 ecr 1683170079], length 13
1768083658.900833 IP 127.0.0.1.31337 > 127.0.0.1.52654: Flags [.], ack 5, win 6380, options [nop,nop,TS val 1683170079 ecr 3465582799], length 0
1768083658.900836 IP 127.0.0.1.31337 > 127.0.0.1.52654: Flags [.], ack 18, win 6380, options [nop,nop,TS val 1683170079 ecr 3465582799], length 0
1768083659.041316 IP 127.0.0.1.31337 > 127.0.0.1.52654: Flags [P.], seq 1:12, ack 18, win 6380, options [nop,nop,TS val 1683170219 ecr 3465582799], length 11
1768083659.041404 IP 127.0.0.1.52654 > 127.0.0.1.31337: Flags [.], ack 12, win 6380, options [nop,nop,TS val 3465582939 ecr 1683170219], length 0
1768083659.041439 IP 127.0.0.1.52654 > 127.0.0.1.31337: Flags [P.], seq 18:22, ack 12, win 6380, options [nop,nop,TS val 3465582939 ecr 1683170219], length 4
1768083659.041445 IP 127.0.0.1.52654 > 127.0.0.1.31337: Flags [P.], seq 22:35, ack 12, win 6380, options [nop,nop,TS val 3465582939 ecr 1683170219], length 13
1768083659.041460 IP 127.0.0.1.31337 > 127.0.0.1.52654: Flags [.], ack 22, win 6380, options [nop,nop,TS val 1683170219 ecr 3465582939], length 0
1768083659.041475 IP 127.0.0.1.31337 > 127.0.0.1.52654: Flags [.], ack 35, win 6380, options [nop,nop,TS val 1683170219 ecr 3465582939], length 0
1768083659.108549 IP 127.0.0.1.31337 > 127.0.0.1.52654: Flags [P.], seq 12:36, ack 35, win 6380, options [nop,nop,TS val 1683170286 ecr 3465582939], length 24
1768083659.108628 IP 127.0.0.1.52654 > 127.0.0.1.31337: Flags [.], ack 36, win 6380, options [nop,nop,TS val 3465583007 ecr 1683170286], length 0
1768083659.108742 IP 127.0.0.1.52654 > 127.0.0.1.31337: Flags [P.], seq 35:39, ack 36, win 6380, options [nop,nop,TS val 3465583007 ecr 1683170286], length 4
1768083659.108747 IP 127.0.0.1.52654 > 127.0.0.1.31337: Flags [P.], seq 39:58, ack 36, win 6380, options [nop,nop,TS val 3465583007 ecr 1683170286], length 19
1768083659.108760 IP 127.0.0.1.31337 > 127.0.0.1.52654: Flags [.], ack 39, win 6380, options [nop,nop,TS val 1683170287 ecr 3465583007], length 0
1768083659.108770 IP 127.0.0.1.31337 > 127.0.0.1.52654: Flags [.], ack 58, win 6380, options [nop,nop,TS val 1683170287 ecr 3465583007], length 0
1768083659.200520 IP 127.0.0.1.31337 > 127.0.0.1.52654: Flags [P.], seq 36:859, ack 58, win 6380, options [nop,nop,TS val 1683170378 ecr 3465583007], length 823
1768083659.200631 IP 127.0.0.1.52654 > 127.0.0.1.31337: Flags [.], ack 859, win 6368, options [nop,nop,TS val 3465583098 ecr 1683170378], length 0
1768083659.455701 IP 127.0.0.1.52654 > 127.0.0.1.31337: Flags [P.], seq 58:62, ack 859, win 6368, options [nop,nop,TS val 3465583354 ecr 1683170378], length 4
1768083659.455707 IP 127.0.0.1.52654 > 127.0.0.1.31337: Flags [P.], seq 62:66, ack 859, win 6368, options [nop,nop,TS val 3465583354 ecr 1683170378], length 4
1768083659.455791 IP 127.0.0.1.31337 > 127.0.0.1.52654: Flags [.], ack 62, win 6380, options [nop,nop,TS val 1683170634 ecr 3465583354], length 0
1768083659.455814 IP 127.0.0.1.31337 > 127.0.0.1.52654: Flags [.], ack 66, win 6380, options [nop,nop,TS val 1683170634 ecr 3465583354], length 0
1768083659.511160 IP 127.0.0.1.31337 > 127.0.0.1.52654: Flags [P.], seq 859:870, ack 66, win 6380, options [nop,nop,TS val 1683170689 ecr 3465583354], length 11
1768083659.511240 IP 127.0.0.1.52654 > 127.0.0.1.31337: Flags [.], ack 870, win 6368, options [nop,nop,TS val 3465583409 ecr 1683170689], length 0
1768083659.511281 IP 127.0.0.1.52654 > 127.0.0.1.31337: Flags [F.], seq 66, ack 870, win 6368, options [nop,nop,TS val 3465583409 ecr 1683170689], length 0
1768083659.511308 IP 127.0.0.1.31337 > 127.0.0.1.52654: Flags [.], ack 67, win 6380, options [nop,nop,TS val 1683170689 ecr 3465583409], length 0
1768083659.588395 IP 127.0.0.1.52655 > 127.0.0.1.31337: Flags [S], seq 2200936579, win 65535, options [mss 16344,nop,wscale 6,nop,nop,TS val 1644737582 ecr 0,sackOK,eol], length 0
1768083659.588488 IP 127.0.0.1.31337 > 127.0.0.1.52655: Flags [S.], seq 170559282, ack 2200936580, win 65535, options [mss 16344,nop,wscale 6,nop,nop,TS val 2496326025 ecr 1644737582,sackOK,eol], length 0
1768083659.588509 IP 127.0.0.1.52655 > 127.0.0.1.31337: Flags [.], ack 1, win 6380, options [nop,nop,TS val 1644737582 ecr 2496326025], length 0
1768083659.588526 IP 127.0.0.1.31337 > 127.0.0.1.52655: Flags [.], ack 1, win 6380, options [nop,nop,TS val 2496326025 ecr 1644737582], length 0
1768083659.588572 IP 127.0.0.1.52655 > 127.0.0.1.31337: Flags [P.], seq 1:5, ack 1, win 6380, options [nop,nop,TS val 1644737582 ecr 2496326025], length 4
1768083659.588577 IP 127.0.0.1.52655 > 127.0.0.1.31337: Flags [P.], seq 5:18, ack 1, win 6380, options [nop,nop,TS val 1644737583 ecr 2496326025], length 13
1768083659.588602 IP 127.0.0.1.31337 > 127.0.0.1.52655: Flags [.], ack 5, win 6380, options [nop,nop,TS val 2496326026 ecr 1644737582], length 0
1768083659.588611 IP 127.0.0.1.31337 > 127.0.0.1.52655: Flags [.], ack 18, win 6380, options [nop,nop,TS val 2496326026 ecr 1644737583], length 0
1768083659.772513 IP 127.0.0.1.31337 > 127.0.0.1.52655: Flags [P.], seq 1:12, ack 18, win 6380, options [nop,nop,TS val 2496326209 ecr 1644737583], length 11
1768083659.772596 IP 127.0.0.1.52655 > 127.0.0.1.31337: Flags [.], ack 12, win 6380, options [nop,nop,TS val 1644737766 ecr 2496326209], length 0
1768083659.772629 IP 127.0.0.1.52655 > 127.0.0.1.31337: Flags [P.], seq 18:22, ack 12, win 6380, options [nop,nop,TS val 1644737767 ecr 2496326209], length 4
1768083659.772632 IP 127.0.0.1.52655 > 127.0.0.1.31337: Flags [P.], seq 22:35, ack 12, win 6380, options [nop,nop,TS val 1644737767 ecr 2496326209], length 13
1768083659.772644 IP 127.0.0.1.31337 > 127.0.0.1.52655: Flags [.], ack 22, win 6380, options [nop,nop,TS val 2496326210 ecr 1644737767], length 0
1768083659.772658 IP 127.0.0.1.31337 > 127.0.0.1.52655: Flags [.], ack 35, win 6380, options [nop,nop,TS val 2496326210 ecr 1644737767], length 0
1768083659.836897 IP 127.0.0.1.31337 > 127.0.0.1.52655: Flags [P.], seq 12:36, ack 35, win 6380, options [nop,nop,TS val 2496326274 ecr 1644737767], length 24
1768083659.836982 IP 127.0.0.1.52655 > 127.0.0.1.31337: Flags [.], ack 36, win 6380, options [nop,nop,TS val 1644737831 ecr 2496326274], length 0
1768083659.837087 IP 127.0.0.1.52655 > 127.0.0.1.31337: Flags [P.], seq 35:39, ack 36, win 6380, options [nop,nop,TS val 1644737831 ecr 2496326274], length 4
1768083659.837092 IP 127.0.0.1.52655 > 127.0.0.1.31337: Flags [P.], seq 39:66, ack 36, win 6380, options [nop,nop,TS val 1644737831 ecr 2496326274], length 27
1768083659.837116 IP 127.0.0.1.31337 > 127.0.0.1.52655: Flags [.], ack 39, win 6380, options [nop,nop,TS val 2496326274 ecr 1644737831], length 0
1768083659.837132 IP 127.0.0.1.31337 > 127.0.0.1.52655: Flags [.], ack 66, win 6380, options [nop,nop,TS val 2496326274 ecr 1644737831], length 0
1768083659.901366 IP 127.0.0.1.31337 > 127.0.0.1.52655: Flags [P.], seq 36:75, ack 66, win 6380, options [nop,nop,TS val 2496326338 ecr 1644737831], length 39
1768083659.901450 IP 127.0.0.1.52655 > 127.0.0.1.31337: Flags [.], ack 75, win 6380, options [nop,nop,TS val 1644737895 ecr 2496326338], length 0
1768083659.901495 IP 127.0.0.1.52655 > 127.0.0.1.31337: Flags [P.], seq 66:70, ack 75, win 6380, options [nop,nop,TS val 1644737895 ecr 2496326338], length 4
1768083659.901499 IP 127.0.0.1.52655 > 127.0.0.1.31337: Flags [P.], seq 70:97, ack 75, win 6380, options [nop,nop,TS val 1644737895 ecr 2496326338], length 27
1768083659.901521 IP 127.0.0.1.31337 > 127.0.0.1.52655: Flags [.], ack 70, win 6380, options [nop,nop,TS val 2496326338 ecr 1644737895], length 0
1768083659.901535 IP 127.0.0.1.31337 > 127.0.0.1.52655: Flags [.], ack 97, win 6380, options [nop,nop,TS val 2496326338 ecr 1644737895], length 0
1768083674.903726 IP 127.0.0.1.52655 > 127.0.0.1.31337: Flags [P.], seq 97:101, ack 75, win 6380, options [nop,nop,TS val 1644752898 ecr 2496326338], length 4
1768083674.903739 IP 127.0.0.1.52655 > 127.0.0.1.31337: Flags [P.], seq 101:105, ack 75, win 6380, options [nop,nop,TS val 1644752898 ecr 2496326338], length 4
1768083674.903799 IP 127.0.0.1.31337 > 127.0.0.1.52655: Flags [.], ack 101, win 6380, options [nop,nop,TS val 2496341341 ecr 1644752898], length 0
1768083674.903819 IP 127.0.0.1.31337 > 127.0.0.1.52655: Flags [.], ack 105, win 6380, options [nop,nop,TS val 2496341341 ecr 1644752898], length 0
1768083718.432529 IP 127.0.0.1.52653 > 127.0.0.1.31337: Flags [R.], seq 2, ack 1, win 6380, length 0
1768083719.972778 IP 127.0.0.1.52654 > 127.0.0.1.31337: Flags [R.], seq 67, ack 870, win 6368, length 0
1768083725.836920 IP 127.0.0.1.52655 > 127.0.0.1.31337: Flags [F.], seq 105, ack 75, win 6380, options [nop,nop,TS val 1644803831 ecr 2496341341], length 0
1768083725.836976 IP 127.0.0.1.31337 > 127.0.0.1.52655: Flags [.], ack 106, win 6380, options [nop,nop,TS val 2496392274 ecr 1644803831], length 0
1768083725.839472 IP 127.0.0.1.31337 > 127.0.0.1.52655: Flags [F.], seq 75, ack 106, win 6380, options [nop,nop,TS val 2496392277 ecr 1644803831], length 0
1768083725.839550 IP 127.0.0.1.52655 > 127.0.0.1.31337: Flags [.], ack 76, win 6380, options [nop,nop,TS val 1644803834 ecr 2496392277], length 0
1768083806.371958 IP 127.0.0.1.52674 > 127.0.0.1.31337: Flags [S], seq 2757788509, win 65535, options [mss 16344,nop,wscale 6,nop,nop,TS val 12443669 ecr 0,sackOK,eol], length 0
1768083806.371981 IP 127.0.0.1.31337 > 127.0.0.1.52674: Flags [R.], seq 0, ack 2757788510, win 0, length 0
1768083865.882078 IP 127.0.0.1.52680 > 127.0.0.1.31337: Flags [S], seq 217168358, win 65535, options [mss 16344,nop,wscale 6,nop,nop,TS val 124228985 ecr 0,sackOK,eol], length 0
1768083865.882193 IP 127.0.0.1.31337 > 127.0.0.1.52680: Flags [S.], seq 1408266495, ack 217168359, win 65535, options [mss 16344,nop,wscale 6,nop,nop,TS val 434831008 ecr 124228985,sackOK,eol], length 0
1768083865.882218 IP 127.0.0.1.52680 > 127.0.0.1.31337: Flags [.], ack 1, win 6380, options [nop,nop,TS val 124228985 ecr 434831008], length 0
1768083865.882237 IP 127.0.0.1.31337 > 127.0.0.1.52680: Flags [.], ack 1, win 6380, options [nop,nop,TS val 434831008 ecr 124228985], length 0
1768083865.882238 IP 127.0.0.1.52680 > 127.0.0.1.31337: Flags [F.], seq 1, ack 1, win 6380, options [nop,nop,TS val 124228985 ecr 434831008], length 0
1768083865.882252 IP 127.0.0.1.31337 > 127.0.0.1.52680: Flags [.], ack 2, win 6380, options [nop,nop,TS val 434831008 ecr 124228985], length 0
1768083866.151653 IP 127.0.0.1.52681 > 127.0.0.1.31337: Flags [S], seq 3648944584, win 65535, options [mss 16344,nop,wscale 6,nop,nop,TS val 1306606657 ecr 0,sackOK,eol], length 0
1768083866.151784 IP 127.0.0.1.31337 > 127.0.0.1.52681: Flags [S.], seq 1850698405, ack 3648944585, win 65535, options [mss 16344,nop,wscale 6,nop,nop,TS val 2086581593 ecr 1306606657,sackOK,eol], length 0
1768083866.151807 IP 127.0.0.1.52681 > 127.0.0.1.31337: Flags [.], ack 1, win 6380, options [nop,nop,TS val 1306606658 ecr 2086581593], length 0
1768083866.151824 IP 127.0.0.1.31337 > 127.0.0.1.52681: Flags [.], ack 1, win 6380, options [nop,nop,TS val 2086581594 ecr 1306606658], length 0
1768083866.151888 IP 127.0.0.1.52681 > 127.0.0.1.31337: Flags [P.], seq 1:5, ack 1, win 6380, options [nop,nop,TS val 1306606658 ecr 2086581594], length 4
1768083866.151895 IP 127.0.0.1.52681 > 127.0.0.1.31337: Flags [P.], seq 5:18, ack 1, win 6380, options [nop,nop,TS val 1306606658 ecr 2086581594], length 13
1768083866.151916 IP 127.0.0.1.31337 > 127.0.0.1.52681: Flags [.], ack 5, win 6380, options [nop,nop,TS val 2086581594 ecr 1306606658], length 0
1768083866.151924 IP 127.0.0.1.31337 > 127.0.0.1.52681: Flags [.], ack 18, win 6380, options [nop,nop,TS val 2086581594 ecr 1306606658], length 0
1768083866.310572 IP 127.0.0.1.31337 > 127.0.0.1.52681: Flags [P.], seq 1:12, ack 18, win 6380, options [nop,nop,TS val 2086581752 ecr 1306606658], length 11
1768083866.310624 IP 127.0.0.1.52681 > 127.0.0.1.31337: Flags [.], ack 12, win 6380, options [nop,nop,TS val 1306606816 ecr 2086581752], length 0
1768083866.310665 IP 127.0.0.1.52681 > 127.0.0.1.31337: Flags [P.], seq 18:22, ack 12, win 6380, options [nop,nop,TS val 1306606816 ecr 2086581752], length 4
1768083866.310671 IP 127.0.0.1.52681 > 127.0.0.1.31337: Flags [P.], seq 22:35, ack 12, win 6380, options [nop,nop,TS val 1306606816 ecr 2086581752], length 13
1768083866.310689 IP 127.0.0.1.31337 > 127.0.0.1.52681: Flags [.], ack 22, win 6380, options [nop,nop,TS val 2086581752 ecr 1306606816], length 0
1768083866.310700 IP 127.0.0.1.31337 > 127.0.0.1.52681: Flags [.], ack 35, win 6380, options [nop,nop,TS val 2086581752 ecr 1306606816], length 0
1768083866.383308 IP 127.0.0.1.31337 > 127.0.0.1.52681: Flags [P.], seq 12:36, ack 35, win 6380, options [nop,nop,TS val 2086581825 ecr 1306606816], length 24
1768083866.383365 IP 127.0.0.1.52681 > 127.0.0.1.31337: Flags [.], ack 36, win 6380, options [nop,nop,TS val 1306606889 ecr 2086581825], length 0
1768083866.383543 IP 127.0.0.1.52681 > 127.0.0.1.31337: Flags [P.], seq 35:39, ack 36, win 6380, options [nop,nop,TS val 1306606889 ecr 2086581825], length 4
1768083866.383550 IP 127.0.0.1.52681 > 127.0.0.1.31337: Flags [P.], seq 39:58, ack 36, win 6380, options [nop,nop,TS val 1306606889 ecr 2086581825], length 19
1768083866.383579 IP 127.0.0.1.31337 > 127.0.0.1.52681: Flags [.], ack 39, win 6380, options [nop,nop,TS val 2086581825 ecr 1306606889], length 0
1768083866.383592 IP 127.0.0.1.31337 > 127.0.0.1.52681: Flags [.], ack 58, win 6380, options [nop,nop,TS val 2086581825 ecr 1306606889], length 0
1768083866.483543 IP 127.0.0.1.31337 > 127.0.0.1.52681: Flags [P.], seq 36:859, ack 58, win 6380, options [nop,nop,TS val 2086581925 ecr 1306606889], length 823
1768083866.483597 IP 127.0.0.1.52681 > 127.0.0.1.31337: Flags [.], ack 859, win 6368, options [nop,nop,TS val 1306606989 ecr 2086581925], length 0
1768083866.738735 IP 127.0.0.1.52681 > 127.0.0.1.31337: Flags [P.], seq 58:62, ack 859, win 6368, options [nop,nop,TS val 1306607244 ecr 2086581925], length 4
1768083866.738745 IP 127.0.0.1.52681 > 127.0.0.1.31337: Flags [P.], seq 62:66, ack 859, win 6368, options [nop,nop,TS val 1306607245 ecr 2086581925], length 4
1768083866.738786 IP 127.0.0.1.31337 > 127.0.0.1.52681: Flags [.], ack 62, win 6380, options [nop,nop,TS val 2086582181 ecr 1306607244], length 0
1768083866.738801 IP 127.0.0.1.31337 > 127.0.0.1.52681: Flags [.], ack 66, win 6380, options [nop,nop,TS val 2086582181 ecr 1306607245], length 0
1768083866.795973 IP 127.0.0.1.31337 > 127.0.0.1.52681: Flags [P.], seq 859:870, ack 66, win 6380, options [nop,nop,TS val 2086582238 ecr 1306607245], length 11
1768083866.796009 IP 127.0.0.1.52681 > 127.0.0.1.31337: Flags [.], ack 870, win 6368, options [nop,nop,TS val 1306607302 ecr 2086582238], length 0
1768083866.796071 IP 127.0.0.1.52681 > 127.0.0.1.31337: Flags [F.], seq 66, ack 870, win 6368, options [nop,nop,TS val 1306607302 ecr 2086582238], length 0
1768083866.796086 IP 127.0.0.1.31337 > 127.0.0.1.52681: Flags [.], ack 67, win 6380, options [nop,nop,TS val 2086582238 ecr 1306607302], length 0
1768083866.890878 IP 127.0.0.1.52682 > 127.0.0.1.31337: Flags [S], seq 1605335387, win 65535, options [mss 16344,nop,wscale 6,nop,nop,TS val 3582260796 ecr 0,sackOK,eol], length 0
1768083866.890966 IP 127.0.0.1.31337 > 127.0.0.1.52682: Flags [S.], seq 4263273636, ack 1605335388, win 65535, options [mss 16344,nop,wscale 6,nop,nop,TS val 1344868161 ecr 3582260796,sackOK,eol], length 0
1768083866.890985 IP 127.0.0.1.52682 > 127.0.0.1.31337: Flags [.], ack 1, win 6380, options [nop,nop,TS val 3582260796 ecr 1344868161], length 0
1768083866.891002 IP 127.0.0.1.31337 > 127.0.0.1.52682: Flags [.], ack 1, win 6380, options [nop,nop,TS val 1344868161 ecr 3582260796], length 0
1768083866.891058 IP 127.0.0.1.52682 > 127.0.0.1.31337: Flags [P.], seq 1:5, ack 1, win 6380, options [nop,nop,TS val 3582260796 ecr 1344868161], length 4
1768083866.891065 IP 127.0.0.1.52682 > 127.0.0.1.31337: Flags [P.], seq 5:18, ack 1, win 6380, options [nop,nop,TS val 3582260796 ecr 1344868161], length 13
1768083866.891084 IP 127.0.0.1.31337 > 127.0.0.1.52682: Flags [.], ack 5, win 6380, options [nop,nop,TS val 1344868161 ecr 3582260796], length 0
1768083866.891089 IP 127.0.0.1.31337 > 127.0.0.1.52682: Flags [.], ack 18, win 6380, options [nop,nop,TS val 1344868161 ecr 3582260796], length 0
1768083867.037816 IP 127.0.0.1.31337 > 127.0.0.1.52682: Flags [P.], seq 1:12, ack 18, win 6380, options [nop,nop,TS val 1344868308 ecr 3582260796], length 11
1768083867.037866 IP 127.0.0.1.52682 > 127.0.0.1.31337: Flags [.], ack 12, win 6380, options [nop,nop,TS val 3582260943 ecr 1344868308], length 0
1768083867.037903 IP 127.0.0.1.52682 > 127.0.0.1.31337: Flags [P.], seq 18:22, ack 12, win 6380, options [nop,nop,TS val 3582260943 ecr 1344868308], length 4
1768083867.037909 IP 127.0.0.1.52682 > 127.0.0.1.31337: Flags [P.], seq 22:35, ack 12, win 6380, options [nop,nop,TS val 3582260943 ecr 1344868308], length 13
1768083867.037926 IP 127.0.0.1.31337 > 127.0.0.1.52682: Flags [.], ack 22, win 6380, options [nop,nop,TS val 1344868308 ecr 3582260943], length 0
1768083867.037939 IP 127.0.0.1.31337 > 127.0.0.1.52682: Flags [.], ack 35, win 6380, options [nop,nop,TS val 1344868308 ecr 3582260943], length 0
1768083867.155131 IP 127.0.0.1.31337 > 127.0.0.1.52682: Flags [P.], seq 12:36, ack 35, win 6380, options [nop,nop,TS val 1344868425 ecr 3582260943], length 24
1768083867.155178 IP 127.0.0.1.52682 > 127.0.0.1.31337: Flags [.], ack 36, win 6380, options [nop,nop,TS val 3582261060 ecr 1344868425], length 0
1768083867.155306 IP 127.0.0.1.52682 > 127.0.0.1.31337: Flags [P.], seq 35:39, ack 36, win 6380, options [nop,nop,TS val 3582261060 ecr 1344868425], length 4
1768083867.155314 IP 127.0.0.1.52682 > 127.0.0.1.31337: Flags [P.], seq 39:66, ack 36, win 6380, options [nop,nop,TS val 3582261060 ecr 1344868425], length 27
1768083867.155331 IP 127.0.0.1.31337 > 127.0.0.1.52682: Flags [.], ack 39, win 6380, options [nop,nop,TS val 1344868425 ecr 3582261060], length 0
1768083867.155341 IP 127.0.0.1.31337 > 127.0.0.1.52682: Flags [.], ack 66, win 6380, options [nop,nop,TS val 1344868425 ecr 3582261060], length 0
1768083867.224265 IP 127.0.0.1.31337 > 127.0.0.1.52682: Flags [P.], seq 36:75, ack 66, win 6380, options [nop,nop,TS val 1344868494 ecr 3582261060], length 39
1768083867.224311 IP 127.0.0.1.52682 > 127.0.0.1.31337: Flags [.], ack 75, win 6380, options [nop,nop,TS val 3582261129 ecr 1344868494], length 0
1768083867.224387 IP 127.0.0.1.52682 > 127.0.0.1.31337: Flags [P.], seq 66:70, ack 75, win 6380, options [nop,nop,TS val 3582261129 ecr 1344868494], length 4
1768083867.224393 IP 127.0.0.1.52682 > 127.0.0.1.31337: Flags [P.], seq 70:97, ack 75, win 6380, options [nop,nop,TS val 3582261129 ecr 1344868494], length 27
1768083867.224410 IP 127.0.0.1.31337 > 127.0.0.1.52682: Flags [.], ack 70, win 6380, options [nop,nop,TS val 1344868494 ecr 3582261129], length 0
1768083867.224421 IP 127.0.0.1.31337 > 127.0.0.1.52682: Flags [.], ack 97, win 6380, options [nop,nop,TS val 1344868494 ecr 3582261129], length 0
1768083882.226479 IP 127.0.0.1.52682 > 127.0.0.1.31337: Flags [P.], seq 97:101, ack 75, win 6380, options [nop,nop,TS val 3582276131 ecr 1344868494], length 4
1768083882.226489 IP 127.0.0.1.52682 > 127.0.0.1.31337: Flags [P.], seq 101:105, ack 75, win 6380, options [nop,nop,TS val 3582276131 ecr 1344868494], length 4
1768083882.226531 IP 127.0.0.1.31337 > 127.0.0.1.52682: Flags [.], ack 101, win 6380, options [nop,nop,TS val 1344883496 ecr 3582276131], length 0
1768083882.226546 IP 127.0.0.1.31337 > 127.0.0.1.52682: Flags [.], ack 105, win 6380, options [nop,nop,TS val 1344883496 ecr 3582276131], length 0
1768083925.882991 IP 127.0.0.1.52680 > 127.0.0.1.31337: Flags [R.], seq 2, ack 1, win 6380, length 0
1768083926.893994 IP 127.0.0.1.52681 > 127.0.0.1.31337: Flags [R.], seq 67, ack 870, win 6368, length 0
1768083987.233208 IP 127.0.0.1.31337 > 127.0.0.1.52682: Flags [F.], seq 75, ack 105, win 6380, options [nop,nop,TS val 1344988503 ecr 3582276131], length 0
1768083987.233273 IP 127.0.0.1.52682 > 127.0.0.1.31337: Flags [.], ack 76, win 6380, options [nop,nop,TS val 3582381138 ecr 1344988503], length 0
1768083987.233431 IP 127.0.0.1.52682 > 127.0.0.1.31337: Flags [F.], seq 105, ack 76, win 6380, options [nop,nop,TS val 3582381139 ecr 1344988503], length 0
1768083987.233454 IP 127.0.0.1.31337 > 127.0.0.1.52682: Flags [.], ack 106, win 6380, options [nop,nop,TS val 1344988504 ecr 3582381139], length 0
1768083987.233573 IP 127.0.0.1.52699 > 127.0.0.1.31337: Flags [S], seq 2161663984, win 65535, options [mss 16344,nop,wscale 6,nop,nop,TS val 3234826300 ecr 0,sackOK,eol], length 0
1768083987.233590 IP 127.0.0.1.31337 > 127.0.0.1.52699: Flags [R.], seq 0, ack 2161663985, win 0, length 0
1768083987.438874 IP 127.0.0.1.52700 > 127.0.0.1.31337: Flags [S], seq 2576586342, win 65535, options [mss 16344,nop,wscale 6,nop,nop,TS val 722869067 ecr 0,sackOK,eol], length 0
1768083987.438917 IP 127.0.0.1.31337 > 127.0.0.1.52700: Flags [R.], seq 0, ack 2576586343, win 0, length 0
1768083987.844844 IP 127.0.0.1.52702 > 127.0.0.1.31337: Flags [S], seq 3716707231, win 65535, options [mss 16344,nop,wscale 6,nop,nop,TS val 2587635411 ecr 0,sackOK,eol], length 0
1768083987.844879 IP 127.0.0.1.31337 > 127.0.0.1.52702: Flags [R.], seq 0, ack 3716707232, win 0, length 0
1768083988.650349 IP 127.0.0.1.52703 > 127.0.0.1.31337: Flags [S], seq 2452665791, win 65535, options [mss 16344,nop,wscale 6,nop,nop,TS val 3190838395 ecr 0,sackOK,eol], length 0
1768083988.650378 IP 127.0.0.1.31337 > 127.0.0.1.52703: Flags [R.], seq 0, ack 2452665792, win 0, length 0
