1768086899.690425 IP 127.0.0.1.53181 > 127.0.0.1.31337: Flags [S], seq 3375412045, win 65535, options [mss 16344,nop,wscale 6,nop,nop,TS val 975086049 ecr 0,sackOK,eol], length 0
1768086899.690448 IP 127.0.0.1.31337 > 127.0.0.1.53181: Flags [R.], seq 0, ack 3375412046, win 0, length 0
1768086950.750870 IP 127.0.0.1.53209 > 127.0.0.1.31337: Flags [S], seq 1210299310, win 65535, options [mss 16344,nop,wscale 6,nop,nop,TS val 2691019035 ecr 0,sackOK,eol], length 0
1768086950.750944 IP 127.0.0.1.31337 > 127.0.0.1.53209: Flags [S.], seq 2906912711, ack 1210299311, win 65535, options [mss 16344,nop,wscale 6,nop,nop,TS val 1816152084 ecr 2691019035,sackOK,eol], length 0
1768086950.750959 IP 127.0.0.1.53209 > 127.0.0.1.31337: Flags [.], ack 1, win 6380, options [nop,nop,TS val 2691019035 ecr 1816152084], length 0
1768086950.750970 IP 127.0.0.1.31337 > 127.0.0.1.53209: Flags [.], ack 1, win 6380, options [nop,nop,TS val 1816152084 ecr 2691019035], length 0
1768086950.750976 IP 127.0.0.1.53209 > 127.0.0.1.31337: Flags [F.], seq 1, ack 1, win 6380, options [nop,nop,TS val 2691019035 ecr 1816152084], length 0
1768086950.750986 IP 127.0.0.1.31337 > 127.0.0.1.53209: Flags [.], ack 2, win 6380, options [nop,nop,TS val 1816152084 ecr 2691019035], length 0
1768086951.213237 IP 127.0.0.1.53210 > 127.0.0.1.31337: Flags [S], seq 3572604811, win 65535, options [mss 16344,nop,wscale 6,nop,nop,TS val 3982026793 ecr 0,sackOK,eol], length 0
1768086951.213314 IP 127.0.0.1.31337 > 127.0.0.1.53210: Flags [S.], seq 299579016, ack 3572604812, win 65535, options [mss 16344,nop,wscale 6,nop,nop,TS val 1026631570 ecr 3982026793,sackOK,eol], length 0
1768086951.213327 IP 127.0.0.1.53210 > 127.0.0.1.31337: Flags [.], ack 1, win 6380, options [nop,nop,TS val 3982026794 ecr 1026631570], length 0
1768086951.213337 IP 127.0.0.1.31337 > 127.0.0.1.53210: Flags [.], ack 1, win 6380, options [nop,nop,TS val 1026631570 ecr 3982026794], length 0
1768086951.213394 IP 127.0.0.1.53210 > 127.0.0.1.31337: Flags [P.], seq 1:5, ack 1, win 6380, options [nop,nop,TS val 3982026794 ecr 1026631570], length 4
1768086951.213400 IP 127.0.0.1.53210 > 127.0.0.1.31337: Flags [P.], seq 5:18, ack 1, win 6380, options [nop,nop,TS val 3982026794 ecr 1026631570], length 13
1768086951.213410 IP 127.0.0.1.31337 > 127.0.0.1.53210: Flags [.], ack 5, win 6380, options [nop,nop,TS val 1026631570 ecr 3982026794], length 0
1768086951.213413 IP 127.0.0.1.31337 > 127.0.0.1.53210: Flags [.], ack 18, win 6380, options [nop,nop,TS val 1026631570 ecr 3982026794], length 0
1768086951.373415 IP 127.0.0.1.31337 > 127.0.0.1.53210: Flags [P.], seq 1:12, ack 18, win 6380, options [nop,nop,TS val 1026631730 ecr 3982026794], length 11
1768086951.373458 IP 127.0.0.1.53210 > 127.0.0.1.31337: Flags [.], ack 12, win 6380, options [nop,nop,TS val 3982026954 ecr 1026631730], length 0
1768086951.373501 IP 127.0.0.1.53210 > 127.0.0.1.31337: Flags [P.], seq 18:22, ack 12, win 6380, options [nop,nop,TS val 3982026954 ecr 1026631730], length 4
1768086951.373507 IP 127.0.0.1.53210 > 127.0.0.1.31337: Flags [P.], seq 22:35, ack 12, win 6380, options [nop,nop,TS val 3982026954 ecr 1026631730], length 13
1768086951.373516 IP 127.0.0.1.31337 > 127.0.0.1.53210: Flags [.], ack 22, win 6380, options [nop,nop,TS val 1026631730 ecr 3982026954], length 0
1768086951.373522 IP 127.0.0.1.31337 > 127.0.0.1.53210: Flags [.], ack 35, win 6380, options [nop,nop,TS val 1026631730 ecr 3982026954], length 0
1768086951.441706 IP 127.0.0.1.31337 > 127.0.0.1.53210: Flags [P.], seq 12:36, ack 35, win 6380, options [nop,nop,TS val 1026631798 ecr 3982026954], length 24
1768086951.441756 IP 127.0.0.1.53210 > 127.0.0.1.31337: Flags [.], ack 36, win 6380, options [nop,nop,TS val 3982027022 ecr 1026631798], length 0
1768086951.441925 IP 127.0.0.1.53210 > 127.0.0.1.31337: Flags [P.], seq 35:39, ack 36, win 6380, options [nop,nop,TS val 3982027022 ecr 1026631798], length 4
1768086951.441931 IP 127.0.0.1.53210 > 127.0.0.1.31337: Flags [P.], seq 39:58, ack 36, win 6380, options [nop,nop,TS val 3982027022 ecr 1026631798], length 19
1768086951.441952 IP 127.0.0.1.31337 > 127.0.0.1.53210: Flags [.], ack 39, win 6380, options [nop,nop,TS val 1026631798 ecr 3982027022], length 0
1768086951.441964 IP 127.0.0.1.31337 > 127.0.0.1.53210: Flags [.], ack 58, win 6380, options [nop,nop,TS val 1026631798 ecr 3982027022], length 0
1768086951.541123 IP 127.0.0.1.31337 > 127.0.0.1.53210: Flags [P.], seq 36:859, ack 58, win 6380, options [nop,nop,TS val 1026631897 ecr 3982027022], length 823
1768086951.541181 IP 127.0.0.1.53210 > 127.0.0.1.31337: Flags [.], ack 859, win 6368, options [nop,nop,TS val 3982027121 ecr 1026631897], length 0
1768086951.792673 IP 127.0.0.1.53210 > 127.0.0.1.31337: Flags [P.], seq 58:62, ack 859, win 6368, options [nop,nop,TS val 3982027373 ecr 1026631897], length 4
1768086951.792682 IP 127.0.0.1.53210 > 127.0.0.1.31337: Flags [P.], seq 62:66, ack 859, win 6368, options [nop,nop,TS val 3982027373 ecr 1026631897], length 4
1768086951.792732 IP 127.0.0.1.31337 > 127.0.0.1.53210: Flags [.], ack 62, win 6380, options [nop,nop,TS val 1026632149 ecr 3982027373], length 0
1768086951.792751 IP 127.0.0.1.31337 > 127.0.0.1.53210: Flags [.], ack 66, win 6380, options [nop,nop,TS val 1026632149 ecr 3982027373], length 0
1768086951.853538 IP 127.0.0.1.31337 > 127.0.0.1.53210: Flags [P.], seq 859:870, ack 66, win 6380, options [nop,nop,TS val 1026632210 ecr 3982027373], length 11
1768086951.853584 IP 127.0.0.1.53210 > 127.0.0.1.31337: Flags [.], ack 870, win 6368, options [nop,nop,TS val 3982027434 ecr 1026632210], length 0
1768086951.853670 IP 127.0.0.1.53210 > 127.0.0.1.31337: Flags [F.], seq 66, ack 870, win 6368, options [nop,nop,TS val 3982027434 ecr 1026632210], length 0
1768086951.853688 IP 127.0.0.1.31337 > 127.0.0.1.53210: Flags [.], ack 67, win 6380, options [nop,nop,TS val 1026632210 ecr 3982027434], length 0
1768086951.930534 IP 127.0.0.1.53211 > 127.0.0.1.31337: Flags [S], seq 537852052, win 65535, options [mss 16344,nop,wscale 6,nop,nop,TS val 498877004 ecr 0,sackOK,eol], length 0
1768086951.930622 IP 127.0.0.1.31337 > 127.0.0.1.53211: Flags [S.], seq 2771908190, ack 537852053, win 65535, options [mss 16344,nop,wscale 6,nop,nop,TS val 1870878548 ecr 498877004,sackOK,eol], length 0
1768086951.930641 IP 127.0.0.1.53211 > 127.0.0.1.31337: Flags [.], ack 1, win 6380, options [nop,nop,TS val 498877004 ecr 1870878548], length 0
1768086951.930657 IP 127.0.0.1.31337 > 127.0.0.1.53211: Flags [.], ack 1, win 6380, options [nop,nop,TS val 1870878548 ecr 498877004], length 0
1768086951.930720 IP 127.0.0.1.53211 > 127.0.0.1.31337: Flags [P.], seq 1:5, ack 1, win 6380, options [nop,nop,TS val 498877004 ecr 1870878548], length 4
1768086951.930726 IP 127.0.0.1.53211 > 127.0.0.1.31337: Flags [P.], seq 5:18, ack 1, win 6380, options [nop,nop,TS val 498877004 ecr 1870878548], length 13
1768086951.930751 IP 127.0.0.1.31337 > 127.0.0.1.53211: Flags [.], ack 5, win 6380, options [nop,nop,TS val 1870878548 ecr 498877004], length 0
1768086951.930761 IP 127.0.0.1.31337 > 127.0.0.1.53211: Flags [.], ack 18, win 6380, options [nop,nop,TS val 1870878548 ecr 498877004], length 0
1768086952.071191 IP 127.0.0.1.31337 > 127.0.0.1.53211: Flags [P.], seq 1:12, ack 18, win 6380, options [nop,nop,TS val 1870878688 ecr 498877004], length 11
1768086952.071255 IP 127.0.0.1.53211 > 127.0.0.1.31337: Flags [.], ack 12, win 6380, options [nop,nop,TS val 498877145 ecr 1870878688], length 0
1768086952.071291 IP 127.0.0.1.53211 > 127.0.0.1.31337: Flags [P.], seq 18:22, ack 12, win 6380, options [nop,nop,TS val 498877145 ecr 1870878688], length 4
1768086952.071296 IP 127.0.0.1.53211 > 127.0.0.1.31337: Flags [P.], seq 22:35, ack 12, win 6380, options [nop,nop,TS val 498877145 ecr 1870878688], length 13
1768086952.071314 IP 127.0.0.1.31337 > 127.0.0.1.53211: Flags [.], ack 22, win 6380, options [nop,nop,TS val 1870878689 ecr 498877145], length 0
1768086952.071326 IP 127.0.0.1.31337 > 127.0.0.1.53211: Flags [.], ack 35, win 6380, options [nop,nop,TS val 1870878689 ecr 498877145], length 0
1768086952.181030 IP 127.0.0.1.31337 > 127.0.0.1.53211: Flags [P.], seq 12:36, ack 35, win 6380, options [nop,nop,TS val 1870878798 ecr 498877145], length 24
1768086952.181091 IP 127.0.0.1.53211 > 127.0.0.1.31337: Flags [.], ack 36, win 6380, options [nop,nop,TS val 498877254 ecr 1870878798], length 0
1768086952.181241 IP 127.0.0.1.53211 > 127.0.0.1.31337: Flags [P.], seq 35:39, ack 36, win 6380, options [nop,nop,TS val 498877255 ecr 1870878798], length 4
1768086952.181246 IP 127.0.0.1.53211 > 127.0.0.1.31337: Flags [P.], seq 39:66, ack 36, win 6380, options [nop,nop,TS val 498877255 ecr 1870878798], length 27
1768086952.181268 IP 127.0.0.1.31337 > 127.0.0.1.53211: Flags [.], ack 39, win 6380, options [nop,nop,TS val 1870878799 ecr 498877255], length 0
1768086952.181281 IP 127.0.0.1.31337 > 127.0.0.1.53211: Flags [.], ack 66, win 6380, options [nop,nop,TS val 1870878799 ecr 498877255], length 0
1768086952.246807 IP 127.0.0.1.31337 > 127.0.0.1.53211: Flags [P.], seq 36:75, ack 66, win 6380, options [nop,nop,TS val 1870878864 ecr 498877255], length 39
1768086952.246883 IP 127.0.0.1.53211 > 127.0.0.1.31337: Flags [.], ack 75, win 6380, options [nop,nop,TS val 498877320 ecr 1870878864], length 0
1768086952.246937 IP 127.0.0.1.53211 > 127.0.0.1.31337: Flags [P.], seq 66:70, ack 75, win 6380, options [nop,nop,TS val 498877320 ecr 1870878864], length 4
1768086952.246943 IP 127.0.0.1.53211 > 127.0.0.1.31337: Flags [P.], seq 70:97, ack 75, win 6380, options [nop,nop,TS val 498877320 ecr 1870878864], length 27
1768086952.246962 IP 127.0.0.1.31337 > 127.0.0.1.53211: Flags [.], ack 70, win 6380, options [nop,nop,TS val 1870878864 ecr 498877320], length 0
1768086952.246974 IP 127.0.0.1.31337 > 127.0.0.1.53211: Flags [.], ack 97, win 6380, options [nop,nop,TS val 1870878864 ecr 498877320], length 0
1768086953.625928 IP 127.0.0.1.31337 > 127.0.0.1.53211: Flags [P.], seq 75:114, ack 97, win 6380, options [nop,nop,TS val 1870880243 ecr 498877320], length 39
1768086953.625990 IP 127.0.0.1.53211 > 127.0.0.1.31337: Flags [.], ack 114, win 6380, options [nop,nop,TS val 498878699 ecr 1870880243], length 0
1768086953.626083 IP 127.0.0.1.53211 > 127.0.0.1.31337: Flags [P.], seq 97:101, ack 114, win 6380, options [nop,nop,TS val 498878699 ecr 1870880243], length 4
1768086953.626089 IP 127.0.0.1.53211 > 127.0.0.1.31337: Flags [P.], seq 101:128, ack 114, win 6380, options [nop,nop,TS val 498878699 ecr 1870880243], length 27
1768086953.626098 IP 127.0.0.1.31337 > 127.0.0.1.53211: Flags [.], ack 101, win 6380, options [nop,nop,TS val 1870880243 ecr 498878699], length 0
1768086953.626106 IP 127.0.0.1.31337 > 127.0.0.1.53211: Flags [.], ack 128, win 6380, options [nop,nop,TS val 1870880243 ecr 498878699], length 0
1768086954.920550 IP 127.0.0.1.31337 > 127.0.0.1.53211: Flags [P.], seq 114:153, ack 128, win 6380, options [nop,nop,TS val 1870881538 ecr 498878699], length 39
1768086954.920630 IP 127.0.0.1.53211 > 127.0.0.1.31337: Flags [.], ack 153, win 6380, options [nop,nop,TS val 498879994 ecr 1870881538], length 0
1768086954.920697 IP 127.0.0.1.53211 > 127.0.0.1.31337: Flags [P.], seq 128:132, ack 153, win 6380, options [nop,nop,TS val 498879994 ecr 1870881538], length 4
1768086954.920703 IP 127.0.0.1.53211 > 127.0.0.1.31337: Flags [P.], seq 132:150, ack 153, win 6380, options [nop,nop,TS val 498879994 ecr 1870881538], length 18
1768086954.920722 IP 127.0.0.1.31337 > 127.0.0.1.53211: Flags [.], ack 132, win 6380, options [nop,nop,TS val 1870881538 ecr 498879994], length 0
1768086954.920737 IP 127.0.0.1.31337 > 127.0.0.1.53211: Flags [.], ack 150, win 6380, options [nop,nop,TS val 1870881538 ecr 498879994], length 0
1768086955.013486 IP 127.0.0.1.31337 > 127.0.0.1.53211: Flags [P.], seq 153:1024, ack 150, win 6380, options [nop,nop,TS val 1870881631 ecr 498879994], length 871
1768086955.013570 IP 127.0.0.1.53211 > 127.0.0.1.31337: Flags [.], ack 1024, win 6367, options [nop,nop,TS val 498880087 ecr 1870881631], length 0
1768086955.013621 IP 127.0.0.1.53211 > 127.0.0.1.31337: Flags [P.], seq 150:154, ack 1024, win 6367, options [nop,nop,TS val 498880087 ecr 1870881631], length 4
1768086955.013626 IP 127.0.0.1.53211 > 127.0.0.1.31337: Flags [P.], seq 154:158, ack 1024, win 6367, options [nop,nop,TS val 498880087 ecr 1870881631], length 4
1768086955.013646 IP 127.0.0.1.31337 > 127.0.0.1.53211: Flags [.], ack 154, win 6380, options [nop,nop,TS val 1870881631 ecr 498880087], length 0
1768086955.013660 IP 127.0.0.1.31337 > 127.0.0.1.53211: Flags [.], ack 158, win 6380, options [nop,nop,TS val 1870881631 ecr 498880087], length 0
1768086955.075918 IP 127.0.0.1.31337 > 127.0.0.1.53211: Flags [P.], seq 1024:1035, ack 158, win 6380, options [nop,nop,TS val 1870881693 ecr 498880087], length 11
1768086955.075989 IP 127.0.0.1.53211 > 127.0.0.1.31337: Flags [.], ack 1035, win 6367, options [nop,nop,TS val 498880149 ecr 1870881693], length 0
1768086955.076038 IP 127.0.0.1.53211 > 127.0.0.1.31337: Flags [F.], seq 158, ack 1035, win 6367, options [nop,nop,TS val 498880149 ecr 1870881693], length 0
1768086955.076068 IP 127.0.0.1.31337 > 127.0.0.1.53211: Flags [.], ack 159, win 6380, options [nop,nop,TS val 1870881693 ecr 498880149], length 0
1768086955.155568 IP 127.0.0.1.53212 > 127.0.0.1.31337: Flags [S], seq 89408921, win 65535, options [mss 16344,nop,wscale 6,nop,nop,TS val 2831769764 ecr 0,sackOK,eol], length 0
1768086955.155653 IP 127.0.0.1.31337 > 127.0.0.1.53212: Flags [S.], seq 321222932, ack 89408922, win 65535, options [mss 16344,nop,wscale 6,nop,nop,TS val 4185944414 ecr 2831769764,sackOK,eol], length 0
1768086955.155672 IP 127.0.0.1.53212 > 127.0.0.1.31337: Flags [.], ack 1, win 6380, options [nop,nop,TS val 2831769764 ecr 4185944414], length 0
1768086955.155688 IP 127.0.0.1.31337 > 127.0.0.1.53212: Flags [.], ack 1, win 6380, options [nop,nop,TS val 4185944414 ecr 2831769764], length 0
1768086955.155735 IP 127.0.0.1.53212 > 127.0.0.1.31337: Flags [P.], seq 1:5, ack 1, win 6380, options [nop,nop,TS val 2831769764 ecr 4185944414], length 4
1768086955.155740 IP 127.0.0.1.53212 > 127.0.0.1.31337: Flags [P.], seq 5:18, ack 1, win 6380, options [nop,nop,TS val 2831769764 ecr 4185944414], length 13
1768086955.155759 IP 127.0.0.1.31337 > 127.0.0.1.53212: Flags [.], ack 5, win 6380, options [nop,nop,TS val 4185944414 ecr 2831769764], length 0
1768086955.155764 IP 127.0.0.1.31337 > 127.0.0.1.53212: Flags [.], ack 18, win 6380, options [nop,nop,TS val 4185944414 ecr 2831769764], length 0
1768086955.316807 IP 127.0.0.1.31337 > 127.0.0.1.53212: Flags [P.], seq 1:12, ack 18, win 6380, options [nop,nop,TS val 4185944575 ecr 2831769764], length 11
1768086955.316879 IP 127.0.0.1.53212 > 127.0.0.1.31337: Flags [.], ack 12, win 6380, options [nop,nop,TS val 2831769925 ecr 4185944575], length 0
1768086955.316924 IP 127.0.0.1.53212 > 127.0.0.1.31337: Flags [P.], seq 18:22, ack 12, win 6380, options [nop,nop,TS val 2831769925 ecr 4185944575], length 4
1768086955.316930 IP 127.0.0.1.53212 > 127.0.0.1.31337: Flags [P.], seq 22:35, ack 12, win 6380, options [nop,nop,TS val 2831769925 ecr 4185944575], length 13
1768086955.316949 IP 127.0.0.1.31337 > 127.0.0.1.53212: Flags [.], ack 22, win 6380, options [nop,nop,TS val 4185944575 ecr 2831769925], length 0
1768086955.316961 IP 127.0.0.1.31337 > 127.0.0.1.53212: Flags [.], ack 35, win 6380, options [nop,nop,TS val 4185944575 ecr 2831769925], length 0
1768086955.381690 IP 127.0.0.1.31337 > 127.0.0.1.53212: Flags [P.], seq 12:36, ack 35, win 6380, options [nop,nop,TS val 4185944640 ecr 2831769925], length 24
1768086955.381768 IP 127.0.0.1.53212 > 127.0.0.1.31337: Flags [.], ack 36, win 6380, options [nop,nop,TS val 2831769990 ecr 4185944640], length 0
1768086955.381893 IP 127.0.0.1.53212 > 127.0.0.1.31337: Flags [P.], seq 35:39, ack 36, win 6380, options [nop,nop,TS val 2831769990 ecr 4185944640], length 4
1768086955.381899 IP 127.0.0.1.53212 > 127.0.0.1.31337: Flags [P.], seq 39:69, ack 36, win 6380, options [nop,nop,TS val 2831769990 ecr 4185944640], length 30
1768086955.381918 IP 127.0.0.1.31337 > 127.0.0.1.53212: Flags [.], ack 39, win 6380, options [nop,nop,TS val 4185944640 ecr 2831769990], length 0
1768086955.381931 IP 127.0.0.1.31337 > 127.0.0.1.53212: Flags [.], ack 69, win 6380, options [nop,nop,TS val 4185944640 ecr 2831769990], length 0
1768086955.445736 IP 127.0.0.1.31337 > 127.0.0.1.53212: Flags [P.], seq 36:88, ack 69, win 6380, options [nop,nop,TS val 4185944704 ecr 2831769990], length 52
1768086955.445815 IP 127.0.0.1.53212 > 127.0.0.1.31337: Flags [.], ack 88, win 6380, options [nop,nop,TS val 2831770054 ecr 4185944704], length 0
1768086955.445867 IP 127.0.0.1.53212 > 127.0.0.1.31337: Flags [F.], seq 69, ack 88, win 6380, options [nop,nop,TS val 2831770054 ecr 4185944704], length 0
1768086955.445899 IP 127.0.0.1.31337 > 127.0.0.1.53212: Flags [.], ack 70, win 6380, options [nop,nop,TS val 4185944704 ecr 2831770054], length 0
1768086955.458426 IP 127.0.0.1.31337 > 127.0.0.1.53212: Flags [F.], seq 88, ack 70, win 6380, options [nop,nop,TS val 4185944717 ecr 2831770054], length 0
1768086955.458436 IP 127.0.0.1.31337 > 127.0.0.1.53211: Flags [F.], seq 1035, ack 159, win 6380, options [nop,nop,TS val 1870882076 ecr 498880149], length 0
1768086955.458441 IP 127.0.0.1.31337 > 127.0.0.1.53210: Flags [F.], seq 870, ack 67, win 6380, options [nop,nop,TS val 1026635815 ecr 3982027434], length 0
1768086955.458447 IP 127.0.0.1.31337 > 127.0.0.1.53209: Flags [F.], seq 1, ack 2, win 6380, options [nop,nop,TS val 1816156792 ecr 2691019035], length 0
1768086955.458484 IP 127.0.0.1.53212 > 127.0.0.1.31337: Flags [.], ack 89, win 6380, options [nop,nop,TS val 2831770067 ecr 4185944717], length 0
1768086955.458502 IP 127.0.0.1.53211 > 127.0.0.1.31337: Flags [.], ack 1036, win 6367, options [nop,nop,TS val 498880532 ecr 1870882076], length 0
1768086955.458515 IP 127.0.0.1.53210 > 127.0.0.1.31337: Flags [.], ack 871, win 6368, options [nop,nop,TS val 3982031039 ecr 1026635815], length 0
1768086955.458524 IP 127.0.0.1.53209 > 127.0.0.1.31337: Flags [.], ack 2, win 6380, options [nop,nop,TS val 2691023743 ecr 1816156792], length 0
1768087353.981407 IP 127.0.0.1.53407 > 127.0.0.1.31337: Flags [S], seq 951851161, win 65535, options [mss 16344,nop,wscale 6,nop,nop,TS val 3561025990 ecr 0,sackOK,eol], length 0
1768087353.981439 IP 127.0.0.1.31337 > 127.0.0.1.53407: Flags [R.], seq 0, ack 951851162, win 0, length 0
1768087404.767197 IP 127.0.0.1.53436 > 127.0.0.1.31337: Flags [S], seq 3828337921, win 65535, options [mss 16344,nop,wscale 6,nop,nop,TS val 3040586148 ecr 0,sackOK,eol], length 0
1768087404.767288 IP 127.0.0.1.31337 > 127.0.0.1.53436: Flags [S.], seq 355363165, ack 3828337922, win 65535, options [mss 16344,nop,wscale 6,nop,nop,TS val 3452943007 ecr 3040586148,sackOK,eol], length 0
1768087404.767310 IP 127.0.0.1.53436 > 127.0.0.1.31337: Flags [.], ack 1, win 6380, options [nop,nop,TS val 3040586149 ecr 3452943007], length 0
1768087404.767327 IP 127.0.0.1.53436 > 127.0.0.1.31337: Flags [F.], seq 1, ack 1, win 6380, options [nop,nop,TS val 3040586149 ecr 3452943007], length 0
1768087404.767329 IP 127.0.0.1.31337 > 127.0.0.1.53436: Flags [.], ack 1, win 6380, options [nop,nop,TS val 3452943008 ecr 3040586149], length 0
1768087404.767339 IP 127.0.0.1.31337 > 127.0.0.1.53436: Flags [.], ack 2, win 6380, options [nop,nop,TS val 3452943008 ecr 3040586149], length 0
1768087405.257098 IP 127.0.0.1.53437 > 127.0.0.1.31337: Flags [S], seq 1065547970, win 65535, options [mss 16344,nop,wscale 6,nop,nop,TS val 3473543179 ecr 0,sackOK,eol], length 0
1768087405.257190 IP 127.0.0.1.31337 > 127.0.0.1.53437: Flags [S.], seq 1383591177, ack 1065547971, win 65535, options [mss 16344,nop,wscale 6,nop,nop,TS val 3190632367 ecr 3473543179,sackOK,eol], length 0
1768087405.257210 IP 127.0.0.1.53437 > 127.0.0.1.31337: Flags [.], ack 1, win 6380, options [nop,nop,TS val 3473543179 ecr 3190632367], length 0
1768087405.257226 IP 127.0.0.1.31337 > 127.0.0.1.53437: Flags [.], ack 1, win 6380, options [nop,nop,TS val 3190632367 ecr 3473543179], length 0
1768087405.257297 IP 127.0.0.1.53437 > 127.0.0.1.31337: Flags [P.], seq 1:5, ack 1, win 6380, options [nop,nop,TS val 3473543180 ecr 3190632367], length 4
1768087405.257303 IP 127.0.0.1.53437 > 127.0.0.1.31337: Flags [P.], seq 5:18, ack 1, win 6380, options [nop,nop,TS val 3473543180 ecr 3190632367], length 13
1768087405.257325 IP 127.0.0.1.31337 > 127.0.0.1.53437: Flags [.], ack 5, win 6380, options [nop,nop,TS val 3190632368 ecr 3473543180], length 0
1768087405.257332 IP 127.0.0.1.31337 > 127.0.0.1.53437: Flags [.], ack 18, win 6380, options [nop,nop,TS val 3190632368 ecr 3473543180], length 0
1768087405.411133 IP 127.0.0.1.31337 > 127.0.0.1.53437: Flags [P.], seq 1:12, ack 18, win 6380, options [nop,nop,TS val 3190632521 ecr 3473543180], length 11
1768087405.411187 IP 127.0.0.1.53437 > 127.0.0.1.31337: Flags [.], ack 12, win 6380, options [nop,nop,TS val 3473543333 ecr 3190632521], length 0
1768087405.411227 IP 127.0.0.1.53437 > 127.0.0.1.31337: Flags [P.], seq 18:22, ack 12, win 6380, options [nop,nop,TS val 3473543333 ecr 3190632521], length 4
1768087405.411232 IP 127.0.0.1.53437 > 127.0.0.1.31337: Flags [P.], seq 22:35, ack 12, win 6380, options [nop,nop,TS val 3473543333 ecr 3190632521], length 13
1768087405.411246 IP 127.0.0.1.31337 > 127.0.0.1.53437: Flags [.], ack 22, win 6380, options [nop,nop,TS val 3190632521 ecr 3473543333], length 0
1768087405.411257 IP 127.0.0.1.31337 > 127.0.0.1.53437: Flags [.], ack 35, win 6380, options [nop,nop,TS val 3190632522 ecr 3473543333], length 0
1768087405.481957 IP 127.0.0.1.31337 > 127.0.0.1.53437: Flags [P.], seq 12:36, ack 35, win 6380, options [nop,nop,TS val 3190632592 ecr 3473543333], length 24
1768087405.482006 IP 127.0.0.1.53437 > 127.0.0.1.31337: Flags [.], ack 36, win 6380, options [nop,nop,TS val 3473543404 ecr 3190632592], length 0
1768087405.482141 IP 127.0.0.1.53437 > 127.0.0.1.31337: Flags [P.], seq 35:39, ack 36, win 6380, options [nop,nop,TS val 3473543404 ecr 3190632592], length 4
1768087405.482146 IP 127.0.0.1.53437 > 127.0.0.1.31337: Flags [P.], seq 39:58, ack 36, win 6380, options [nop,nop,TS val 3473543404 ecr 3190632592], length 19
1768087405.482164 IP 127.0.0.1.31337 > 127.0.0.1.53437: Flags [.], ack 39, win 6380, options [nop,nop,TS val 3190632592 ecr 3473543404], length 0
1768087405.482176 IP 127.0.0.1.31337 > 127.0.0.1.53437: Flags [.], ack 58, win 6380, options [nop,nop,TS val 3190632592 ecr 3473543404], length 0
1768087405.582487 IP 127.0.0.1.31337 > 127.0.0.1.53437: Flags [P.], seq 36:859, ack 58, win 6380, options [nop,nop,TS val 3190632693 ecr 3473543404], length 823
1768087405.582536 IP 127.0.0.1.53437 > 127.0.0.1.31337: Flags [.], ack 859, win 6368, options [nop,nop,TS val 3473543505 ecr 3190632693], length 0
1768087405.837493 IP 127.0.0.1.53437 > 127.0.0.1.31337: Flags [P.], seq 58:62, ack 859, win 6368, options [nop,nop,TS val 3473543760 ecr 3190632693], length 4
1768087405.837505 IP 127.0.0.1.53437 > 127.0.0.1.31337: Flags [P.], seq 62:66, ack 859, win 6368, options [nop,nop,TS val 3473543760 ecr 3190632693], length 4
1768087405.837551 IP 127.0.0.1.31337 > 127.0.0.1.53437: Flags [.], ack 62, win 6380, options [nop,nop,TS val 3190632948 ecr 3473543760], length 0
1768087405.837567 IP 127.0.0.1.31337 > 127.0.0.1.53437: Flags [.], ack 66, win 6380, options [nop,nop,TS val 3190632948 ecr 3473543760], length 0
1768087405.898814 IP 127.0.0.1.31337 > 127.0.0.1.53437: Flags [P.], seq 859:870, ack 66, win 6380, options [nop,nop,TS val 3190633009 ecr 3473543760], length 11
1768087405.898859 IP 127.0.0.1.53437 > 127.0.0.1.31337: Flags [.], ack 870, win 6368, options [nop,nop,TS val 3473543821 ecr 3190633009], length 0
1768087405.898922 IP 127.0.0.1.53437 > 127.0.0.1.31337: Flags [F.], seq 66, ack 870, win 6368, options [nop,nop,TS val 3473543821 ecr 3190633009], length 0
1768087405.898963 IP 127.0.0.1.31337 > 127.0.0.1.53437: Flags [.], ack 67, win 6380, options [nop,nop,TS val 3190633009 ecr 3473543821], length 0
1768087405.993588 IP 127.0.0.1.53438 > 127.0.0.1.31337: Flags [S], seq 28385120, win 65535, options [mss 16344,nop,wscale 6,nop,nop,TS val 1086695408 ecr 0,sackOK,eol], length 0
1768087405.993657 IP 127.0.0.1.31337 > 127.0.0.1.53438: Flags [S.], seq 2016814322, ack 28385121, win 65535, options [mss 16344,nop,wscale 6,nop,nop,TS val 2459017605 ecr 1086695408,sackOK,eol], length 0
1768087405.993669 IP 127.0.0.1.53438 > 127.0.0.1.31337: Flags [.], ack 1, win 6380, options [nop,nop,TS val 1086695408 ecr 2459017605], length 0
1768087405.993678 IP 127.0.0.1.31337 > 127.0.0.1.53438: Flags [.], ack 1, win 6380, options [nop,nop,TS val 2459017605 ecr 1086695408], length 0
1768087405.993729 IP 127.0.0.1.53438 > 127.0.0.1.31337: Flags [P.], seq 1:5, ack 1, win 6380, options [nop,nop,TS val 1086695408 ecr 2459017605], length 4
1768087405.993735 IP 127.0.0.1.53438 > 127.0.0.1.31337: Flags [P.], seq 5:18, ack 1, win 6380, options [nop,nop,TS val 1086695408 ecr 2459017605], length 13
1768087405.993743 IP 127.0.0.1.31337 > 127.0.0.1.53438: Flags [.], ack 5, win 6380, options [nop,nop,TS val 2459017605 ecr 1086695408], length 0
1768087405.993745 IP 127.0.0.1.31337 > 127.0.0.1.53438: Flags [.], ack 18, win 6380, options [nop,nop,TS val 2459017605 ecr 1086695408], length 0
1768087406.188954 IP 127.0.0.1.31337 > 127.0.0.1.53438: Flags [P.], seq 1:12, ack 18, win 6380, options [nop,nop,TS val 2459017800 ecr 1086695408], length 11
1768087406.189021 IP 127.0.0.1.53438 > 127.0.0.1.31337: Flags [.], ack 12, win 6380, options [nop,nop,TS val 1086695603 ecr 2459017800], length 0
1768087406.189080 IP 127.0.0.1.53438 > 127.0.0.1.31337: Flags [P.], seq 18:22, ack 12, win 6380, options [nop,nop,TS val 1086695603 ecr 2459017800], length 4
1768087406.189085 IP 127.0.0.1.53438 > 127.0.0.1.31337: Flags [P.], seq 22:35, ack 12, win 6380, options [nop,nop,TS val 1086695603 ecr 2459017800], length 13
1768087406.189093 IP 127.0.0.1.31337 > 127.0.0.1.53438: Flags [.], ack 22, win 6380, options [nop,nop,TS val 2459017800 ecr 1086695603], length 0
1768087406.189098 IP 127.0.0.1.31337 > 127.0.0.1.53438: Flags [.], ack 35, win 6380, options [nop,nop,TS val 2459017800 ecr 1086695603], length 0
1768087406.259957 IP 127.0.0.1.31337 > 127.0.0.1.53438: Flags [P.], seq 12:36, ack 35, win 6380, options [nop,nop,TS val 2459017871 ecr 1086695603], length 24
1768087406.260007 IP 127.0.0.1.53438 > 127.0.0.1.31337: Flags [.], ack 36, win 6380, options [nop,nop,TS val 1086695674 ecr 2459017871], length 0
1768087406.260143 IP 127.0.0.1.53438 > 127.0.0.1.31337: Flags [P.], seq 35:39, ack 36, win 6380, options [nop,nop,TS val 1086695674 ecr 2459017871], length 4
1768087406.260149 IP 127.0.0.1.53438 > 127.0.0.1.31337: Flags [P.], seq 39:66, ack 36, win 6380, options [nop,nop,TS val 1086695674 ecr 2459017871], length 27
1768087406.260167 IP 127.0.0.1.31337 > 127.0.0.1.53438: Flags [.], ack 39, win 6380, options [nop,nop,TS val 2459017871 ecr 1086695674], length 0
1768087406.260178 IP 127.0.0.1.31337 > 127.0.0.1.53438: Flags [.], ack 66, win 6380, options [nop,nop,TS val 2459017871 ecr 1086695674], length 0
1768087406.328178 IP 127.0.0.1.31337 > 127.0.0.1.53438: Flags [P.], seq 36:75, ack 66, win 6380, options [nop,nop,TS val 2459017939 ecr 1086695674], length 39
1768087406.328224 IP 127.0.0.1.53438 > 127.0.0.1.31337: Flags [.], ack 75, win 6380, options [nop,nop,TS val 1086695742 ecr 2459017939], length 0
1768087406.328295 IP 127.0.0.1.53438 > 127.0.0.1.31337: Flags [P.], seq 66:70, ack 75, win 6380, options [nop,nop,TS val 1086695743 ecr 2459017939], length 4
1768087406.328301 IP 127.0.0.1.53438 > 127.0.0.1.31337: Flags [P.], seq 70:97, ack 75, win 6380, options [nop,nop,TS val 1086695743 ecr 2459017939], length 27
1768087406.328318 IP 127.0.0.1.31337 > 127.0.0.1.53438: Flags [.], ack 70, win 6380, options [nop,nop,TS val 2459017940 ecr 1086695743], length 0
1768087406.328328 IP 127.0.0.1.31337 > 127.0.0.1.53438: Flags [.], ack 97, win 6380, options [nop,nop,TS val 2459017940 ecr 1086695743], length 0
1768087407.815229 IP 127.0.0.1.31337 > 127.0.0.1.53438: Flags [P.], seq 75:114, ack 97, win 6380, options [nop,nop,TS val 2459019426 ecr 1086695743], length 39
1768087407.815280 IP 127.0.0.1.53438 > 127.0.0.1.31337: Flags [.], ack 114, win 6380, options [nop,nop,TS val 1086697230 ecr 2459019426], length 0
1768087407.815357 IP 127.0.0.1.53438 > 127.0.0.1.31337: Flags [P.], seq 97:101, ack 114, win 6380, options [nop,nop,TS val 1086697230 ecr 2459019426], length 4
1768087407.815365 IP 127.0.0.1.53438 > 127.0.0.1.31337: Flags [P.], seq 101:128, ack 114, win 6380, options [nop,nop,TS val 1086697230 ecr 2459019426], length 27
1768087407.815381 IP 127.0.0.1.31337 > 127.0.0.1.53438: Flags [.], ack 101, win 6380, options [nop,nop,TS val 2459019427 ecr 1086697230], length 0
1768087407.815391 IP 127.0.0.1.31337 > 127.0.0.1.53438: Flags [.], ack 128, win 6380, options [nop,nop,TS val 2459019427 ecr 1086697230], length 0
1768087409.523075 IP 127.0.0.1.31337 > 127.0.0.1.53438: Flags [P.], seq 114:153, ack 128, win 6380, options [nop,nop,TS val 2459021134 ecr 1086697230], length 39
1768087409.523125 IP 127.0.0.1.53438 > 127.0.0.1.31337: Flags [.], ack 153, win 6380, options [nop,nop,TS val 1086698937 ecr 2459021134], length 0
1768087409.523227 IP 127.0.0.1.53438 > 127.0.0.1.31337: Flags [P.], seq 128:132, ack 153, win 6380, options [nop,nop,TS val 1086698937 ecr 2459021134], length 4
1768087409.523234 IP 127.0.0.1.53438 > 127.0.0.1.31337: Flags [P.], seq 132:150, ack 153, win 6380, options [nop,nop,TS val 1086698938 ecr 2459021134], length 18
1768087409.523251 IP 127.0.0.1.31337 > 127.0.0.1.53438: Flags [.], ack 132, win 6380, options [nop,nop,TS val 2459021135 ecr 1086698937], length 0
1768087409.523261 IP 127.0.0.1.31337 > 127.0.0.1.53438: Flags [.], ack 150, win 6380, options [nop,nop,TS val 2459021135 ecr 1086698938], length 0
1768087409.624060 IP 127.0.0.1.31337 > 127.0.0.1.53438: Flags [P.], seq 153:1024, ack 150, win 6380, options [nop,nop,TS val 2459021235 ecr 1086698938], length 871
1768087409.624112 IP 127.0.0.1.53438 > 127.0.0.1.31337: Flags [.], ack 1024, win 6367, options [nop,nop,TS val 1086699038 ecr 2459021235], length 0
1768087409.624189 IP 127.0.0.1.53438 > 127.0.0.1.31337: Flags [P.], seq 150:154, ack 1024, win 6367, options [nop,nop,TS val 1086699038 ecr 2459021235], length 4
1768087409.624196 IP 127.0.0.1.53438 > 127.0.0.1.31337: Flags [P.], seq 154:158, ack 1024, win 6367, options [nop,nop,TS val 1086699038 ecr 2459021235], length 4
1768087409.624219 IP 127.0.0.1.31337 > 127.0.0.1.53438: Flags [.], ack 154, win 6380, options [nop,nop,TS val 2459021235 ecr 1086699038], length 0
1768087409.624232 IP 127.0.0.1.31337 > 127.0.0.1.53438: Flags [.], ack 158, win 6380, options [nop,nop,TS val 2459021235 ecr 1086699038], length 0
1768087409.692377 IP 127.0.0.1.31337 > 127.0.0.1.53438: Flags [P.], seq 1024:1035, ack 158, win 6380, options [nop,nop,TS val 2459021304 ecr 1086699038], length 11
1768087409.692426 IP 127.0.0.1.53438 > 127.0.0.1.31337: Flags [.], ack 1035, win 6367, options [nop,nop,TS val 1086699107 ecr 2459021304], length 0
1768087409.692502 IP 127.0.0.1.53438 > 127.0.0.1.31337: Flags [F.], seq 158, ack 1035, win 6367, options [nop,nop,TS val 1086699107 ecr 2459021304], length 0
1768087409.692530 IP 127.0.0.1.31337 > 127.0.0.1.53438: Flags [.], ack 159, win 6380, options [nop,nop,TS val 2459021304 ecr 1086699107], length 0
1768087409.788588 IP 127.0.0.1.53440 > 127.0.0.1.31337: Flags [S], seq 2813216159, win 65535, options [mss 16344,nop,wscale 6,nop,nop,TS val 457994955 ecr 0,sackOK,eol], length 0
1768087409.788656 IP 127.0.0.1.31337 > 127.0.0.1.53440: Flags [S.], seq 2235085712, ack 2813216160, win 65535, options [mss 16344,nop,wscale 6,nop,nop,TS val 2641277132 ecr 457994955,sackOK,eol], length 0
1768087409.788671 IP 127.0.0.1.53440 > 127.0.0.1.31337: Flags [.], ack 1, win 6380, options [nop,nop,TS val 457994955 ecr 2641277132], length 0
1768087409.788681 IP 127.0.0.1.31337 > 127.0.0.1.53440: Flags [.], ack 1, win 6380, options [nop,nop,TS val 2641277132 ecr 457994955], length 0
1768087409.788761 IP 127.0.0.1.53440 > 127.0.0.1.31337: Flags [P.], seq 1:5, ack 1, win 6380, options [nop,nop,TS val 457994955 ecr 2641277132], length 4
1768087409.788769 IP 127.0.0.1.53440 > 127.0.0.1.31337: Flags [P.], seq 5:18, ack 1, win 6380, options [nop,nop,TS val 457994955 ecr 2641277132], length 13
1768087409.788779 IP 127.0.0.1.31337 > 127.0.0.1.53440: Flags [.], ack 5, win 6380, options [nop,nop,TS val 2641277132 ecr 457994955], length 0
1768087409.788784 IP 127.0.0.1.31337 > 127.0.0.1.53440: Flags [.], ack 18, win 6380, options [nop,nop,TS val 2641277132 ecr 457994955], length 0
1768087409.939822 IP 127.0.0.1.31337 > 127.0.0.1.53440: Flags [P.], seq 1:12, ack 18, win 6380, options [nop,nop,TS val 2641277283 ecr 457994955], length 11
1768087409.939872 IP 127.0.0.1.53440 > 127.0.0.1.31337: Flags [.], ack 12, win 6380, options [nop,nop,TS val 457995106 ecr 2641277283], length 0
1768087409.939912 IP 127.0.0.1.53440 > 127.0.0.1.31337: Flags [P.], seq 18:22, ack 12, win 6380, options [nop,nop,TS val 457995106 ecr 2641277283], length 4
1768087409.939918 IP 127.0.0.1.53440 > 127.0.0.1.31337: Flags [P.], seq 22:35, ack 12, win 6380, options [nop,nop,TS val 457995106 ecr 2641277283], length 13
1768087409.939935 IP 127.0.0.1.31337 > 127.0.0.1.53440: Flags [.], ack 22, win 6380, options [nop,nop,TS val 2641277283 ecr 457995106], length 0
1768087409.939947 IP 127.0.0.1.31337 > 127.0.0.1.53440: Flags [.], ack 35, win 6380, options [nop,nop,TS val 2641277283 ecr 457995106], length 0
1768087410.007340 IP 127.0.0.1.31337 > 127.0.0.1.53440: Flags [P.], seq 12:36, ack 35, win 6380, options [nop,nop,TS val 2641277351 ecr 457995106], length 24
1768087410.007396 IP 127.0.0.1.53440 > 127.0.0.1.31337: Flags [.], ack 36, win 6380, options [nop,nop,TS val 457995174 ecr 2641277351], length 0
1768087410.007523 IP 127.0.0.1.53440 > 127.0.0.1.31337: Flags [P.], seq 35:39, ack 36, win 6380, options [nop,nop,TS val 457995174 ecr 2641277351], length 4
1768087410.007528 IP 127.0.0.1.53440 > 127.0.0.1.31337: Flags [P.], seq 39:69, ack 36, win 6380, options [nop,nop,TS val 457995174 ecr 2641277351], length 30
1768087410.007543 IP 127.0.0.1.31337 > 127.0.0.1.53440: Flags [.], ack 39, win 6380, options [nop,nop,TS val 2641277351 ecr 457995174], length 0
1768087410.007551 IP 127.0.0.1.31337 > 127.0.0.1.53440: Flags [.], ack 69, win 6380, options [nop,nop,TS val 2641277351 ecr 457995174], length 0
1768087410.073141 IP 127.0.0.1.31337 > 127.0.0.1.53440: Flags [P.], seq 36:88, ack 69, win 6380, options [nop,nop,TS val 2641277416 ecr 457995174], length 52
1768087410.073191 IP 127.0.0.1.53440 > 127.0.0.1.31337: Flags [.], ack 88, win 6380, options [nop,nop,TS val 457995239 ecr 2641277416], length 0
1768087410.073259 IP 127.0.0.1.53440 > 127.0.0.1.31337: Flags [P.], seq 69:73, ack 88, win 6380, options [nop,nop,TS val 457995240 ecr 2641277416], length 4
1768087410.073264 IP 127.0.0.1.53440 > 127.0.0.1.31337: Flags [P.], seq 73:77, ack 88, win 6380, options [nop,nop,TS val 457995240 ecr 2641277416], length 4
1768087410.073281 IP 127.0.0.1.31337 > 127.0.0.1.53440: Flags [.], ack 73, win 6380, options [nop,nop,TS val 2641277417 ecr 457995240], length 0
1768087410.073293 IP 127.0.0.1.31337 > 127.0.0.1.53440: Flags [.], ack 77, win 6380, options [nop,nop,TS val 2641277417 ecr 457995240], length 0
1768087430.077330 IP 127.0.0.1.53440 > 127.0.0.1.31337: Flags [F.], seq 77, ack 88, win 6380, options [nop,nop,TS val 458015244 ecr 2641277417], length 0
1768087430.077387 IP 127.0.0.1.31337 > 127.0.0.1.53440: Flags [.], ack 78, win 6380, options [nop,nop,TS val 2641297421 ecr 458015244], length 0
1768087430.186344 IP 127.0.0.1.53444 > 127.0.0.1.31337: Flags [S], seq 1318173824, win 65535, options [mss 16344,nop,wscale 6,nop,nop,TS val 2436995548 ecr 0,sackOK,eol], length 0
1768087430.186433 IP 127.0.0.1.31337 > 127.0.0.1.53444: Flags [S.], seq 1541198548, ack 1318173825, win 65535, options [mss 16344,nop,wscale 6,nop,nop,TS val 3187388142 ecr 2436995548,sackOK,eol], length 0
1768087430.186449 IP 127.0.0.1.53444 > 127.0.0.1.31337: Flags [.], ack 1, win 6380, options [nop,nop,TS val 2436995548 ecr 3187388142], length 0
1768087430.186461 IP 127.0.0.1.31337 > 127.0.0.1.53444: Flags [.], ack 1, win 6380, options [nop,nop,TS val 3187388142 ecr 2436995548], length 0
1768087430.186504 IP 127.0.0.1.53444 > 127.0.0.1.31337: Flags [P.], seq 1:5, ack 1, win 6380, options [nop,nop,TS val 2436995548 ecr 3187388142], length 4
1768087430.186510 IP 127.0.0.1.53444 > 127.0.0.1.31337: Flags [P.], seq 5:18, ack 1, win 6380, options [nop,nop,TS val 2436995548 ecr 3187388142], length 13
1768087430.186524 IP 127.0.0.1.31337 > 127.0.0.1.53444: Flags [.], ack 5, win 6380, options [nop,nop,TS val 3187388142 ecr 2436995548], length 0
1768087430.186528 IP 127.0.0.1.31337 > 127.0.0.1.53444: Flags [.], ack 18, win 6380, options [nop,nop,TS val 3187388142 ecr 2436995548], length 0
1768087430.325401 IP 127.0.0.1.31337 > 127.0.0.1.53444: Flags [P.], seq 1:12, ack 18, win 6380, options [nop,nop,TS val 3187388281 ecr 2436995548], length 11
1768087430.325451 IP 127.0.0.1.53444 > 127.0.0.1.31337: Flags [.], ack 12, win 6380, options [nop,nop,TS val 2436995687 ecr 3187388281], length 0
1768087430.325495 IP 127.0.0.1.53444 > 127.0.0.1.31337: Flags [P.], seq 18:22, ack 12, win 6380, options [nop,nop,TS val 2436995687 ecr 3187388281], length 4
1768087430.325503 IP 127.0.0.1.53444 > 127.0.0.1.31337: Flags [P.], seq 22:35, ack 12, win 6380, options [nop,nop,TS val 2436995687 ecr 3187388281], length 13
1768087430.325519 IP 127.0.0.1.31337 > 127.0.0.1.53444: Flags [.], ack 22, win 6380, options [nop,nop,TS val 3187388281 ecr 2436995687], length 0
1768087430.325531 IP 127.0.0.1.31337 > 127.0.0.1.53444: Flags [.], ack 35, win 6380, options [nop,nop,TS val 3187388281 ecr 2436995687], length 0
1768087430.389389 IP 127.0.0.1.31337 > 127.0.0.1.53444: Flags [P.], seq 12:36, ack 35, win 6380, options [nop,nop,TS val 3187388345 ecr 2436995687], length 24
1768087430.389433 IP 127.0.0.1.53444 > 127.0.0.1.31337: Flags [.], ack 36, win 6380, options [nop,nop,TS val 2436995751 ecr 3187388345], length 0
1768087430.389566 IP 127.0.0.1.53444 > 127.0.0.1.31337: Flags [P.], seq 35:39, ack 36, win 6380, options [nop,nop,TS val 2436995751 ecr 3187388345], length 4
1768087430.389570 IP 127.0.0.1.53444 > 127.0.0.1.31337: Flags [P.], seq 39:61, ack 36, win 6380, options [nop,nop,TS val 2436995751 ecr 3187388345], length 22
1768087430.389585 IP 127.0.0.1.31337 > 127.0.0.1.53444: Flags [.], ack 39, win 6380, options [nop,nop,TS val 3187388345 ecr 2436995751], length 0
1768087430.389595 IP 127.0.0.1.31337 > 127.0.0.1.53444: Flags [.], ack 61, win 6380, options [nop,nop,TS val 3187388345 ecr 2436995751], length 0
1768087430.451770 IP 127.0.0.1.31337 > 127.0.0.1.53444: Flags [P.], seq 36:88, ack 61, win 6380, options [nop,nop,TS val 3187388407 ecr 2436995751], length 52
1768087430.451818 IP 127.0.0.1.53444 > 127.0.0.1.31337: Flags [.], ack 88, win 6380, options [nop,nop,TS val 2436995813 ecr 3187388407], length 0
1768087430.451881 IP 127.0.0.1.53444 > 127.0.0.1.31337: Flags [P.], seq 61:65, ack 88, win 6380, options [nop,nop,TS val 2436995813 ecr 3187388407], length 4
1768087430.451885 IP 127.0.0.1.53444 > 127.0.0.1.31337: Flags [P.], seq 65:69, ack 88, win 6380, options [nop,nop,TS val 2436995813 ecr 3187388407], length 4
1768087430.451905 IP 127.0.0.1.31337 > 127.0.0.1.53444: Flags [.], ack 65, win 6380, options [nop,nop,TS val 3187388407 ecr 2436995813], length 0
1768087430.451916 IP 127.0.0.1.31337 > 127.0.0.1.53444: Flags [.], ack 69, win 6380, options [nop,nop,TS val 3187388407 ecr 2436995813], length 0
1768087450.455955 IP 127.0.0.1.53444 > 127.0.0.1.31337: Flags [F.], seq 69, ack 88, win 6380, options [nop,nop,TS val 2437015817 ecr 3187388407], length 0
1768087450.456013 IP 127.0.0.1.31337 > 127.0.0.1.53444: Flags [.], ack 70, win 6380, options [nop,nop,TS val 3187408411 ecr 2437015817], length 0
1768087450.582702 IP 127.0.0.1.53457 > 127.0.0.1.31337: Flags [S], seq 1070369614, win 65535, options [mss 16344,nop,wscale 6,nop,nop,TS val 4194810028 ecr 0,sackOK,eol], length 0
1768087450.582787 IP 127.0.0.1.31337 > 127.0.0.1.53457: Flags [S.], seq 1557038709, ack 1070369615, win 65535, options [mss 16344,nop,wscale 6,nop,nop,TS val 2612316830 ecr 4194810028,sackOK,eol], length 0
1768087450.582806 IP 127.0.0.1.53457 > 127.0.0.1.31337: Flags [.], ack 1, win 6380, options [nop,nop,TS val 4194810028 ecr 2612316830], length 0
1768087450.582823 IP 127.0.0.1.31337 > 127.0.0.1.53457: Flags [.], ack 1, win 6380, options [nop,nop,TS val 2612316830 ecr 4194810028], length 0
1768087450.582891 IP 127.0.0.1.53457 > 127.0.0.1.31337: Flags [P.], seq 1:5, ack 1, win 6380, options [nop,nop,TS val 4194810028 ecr 2612316830], length 4
1768087450.582897 IP 127.0.0.1.53457 > 127.0.0.1.31337: Flags [P.], seq 5:18, ack 1, win 6380, options [nop,nop,TS val 4194810028 ecr 2612316830], length 13
1768087450.582915 IP 127.0.0.1.31337 > 127.0.0.1.53457: Flags [.], ack 5, win 6380, options [nop,nop,TS val 2612316830 ecr 4194810028], length 0
1768087450.582921 IP 127.0.0.1.31337 > 127.0.0.1.53457: Flags [.], ack 18, win 6380, options [nop,nop,TS val 2612316830 ecr 4194810028], length 0
1768087450.716364 IP 127.0.0.1.31337 > 127.0.0.1.53457: Flags [P.], seq 1:12, ack 18, win 6380, options [nop,nop,TS val 2612316964 ecr 4194810028], length 11
1768087450.716415 IP 127.0.0.1.53457 > 127.0.0.1.31337: Flags [.], ack 12, win 6380, options [nop,nop,TS val 4194810162 ecr 2612316964], length 0
1768087450.716455 IP 127.0.0.1.53457 > 127.0.0.1.31337: Flags [P.], seq 18:22, ack 12, win 6380, options [nop,nop,TS val 4194810162 ecr 2612316964], length 4
1768087450.716461 IP 127.0.0.1.53457 > 127.0.0.1.31337: Flags [P.], seq 22:35, ack 12, win 6380, options [nop,nop,TS val 4194810162 ecr 2612316964], length 13
1768087450.716479 IP 127.0.0.1.31337 > 127.0.0.1.53457: Flags [.], ack 22, win 6380, options [nop,nop,TS val 2612316964 ecr 4194810162], length 0
1768087450.716489 IP 127.0.0.1.31337 > 127.0.0.1.53457: Flags [.], ack 35, win 6380, options [nop,nop,TS val 2612316964 ecr 4194810162], length 0
1768087450.778372 IP 127.0.0.1.31337 > 127.0.0.1.53457: Flags [P.], seq 12:36, ack 35, win 6380, options [nop,nop,TS val 2612317026 ecr 4194810162], length 24
1768087450.778419 IP 127.0.0.1.53457 > 127.0.0.1.31337: Flags [.], ack 36, win 6380, options [nop,nop,TS val 4194810224 ecr 2612317026], length 0
1768087450.778554 IP 127.0.0.1.53457 > 127.0.0.1.31337: Flags [P.], seq 35:39, ack 36, win 6380, options [nop,nop,TS val 4194810224 ecr 2612317026], length 4
1768087450.778559 IP 127.0.0.1.53457 > 127.0.0.1.31337: Flags [P.], seq 39:67, ack 36, win 6380, options [nop,nop,TS val 4194810224 ecr 2612317026], length 28
1768087450.778575 IP 127.0.0.1.31337 > 127.0.0.1.53457: Flags [.], ack 39, win 6380, options [nop,nop,TS val 2612317026 ecr 4194810224], length 0
1768087450.778586 IP 127.0.0.1.31337 > 127.0.0.1.53457: Flags [.], ack 67, win 6380, options [nop,nop,TS val 2612317026 ecr 4194810224], length 0
1768087450.840250 IP 127.0.0.1.31337 > 127.0.0.1.53457: Flags [P.], seq 36:88, ack 67, win 6380, options [nop,nop,TS val 2612317088 ecr 4194810224], length 52
1768087450.840298 IP 127.0.0.1.53457 > 127.0.0.1.31337: Flags [.], ack 88, win 6380, options [nop,nop,TS val 4194810286 ecr 2612317088], length 0
1768087450.840364 IP 127.0.0.1.53457 > 127.0.0.1.31337: Flags [P.], seq 67:71, ack 88, win 6380, options [nop,nop,TS val 4194810286 ecr 2612317088], length 4
1768087450.840369 IP 127.0.0.1.53457 > 127.0.0.1.31337: Flags [P.], seq 71:75, ack 88, win 6380, options [nop,nop,TS val 4194810286 ecr 2612317088], length 4
1768087450.840387 IP 127.0.0.1.31337 > 127.0.0.1.53457: Flags [.], ack 71, win 6380, options [nop,nop,TS val 2612317088 ecr 4194810286], length 0
1768087450.840398 IP 127.0.0.1.31337 > 127.0.0.1.53457: Flags [.], ack 75, win 6380, options [nop,nop,TS val 2612317088 ecr 4194810286], length 0
1768087464.768650 IP 127.0.0.1.53436 > 127.0.0.1.31337: Flags [R.], seq 2, ack 1, win 6380, length 0
1768087466.309689 IP 127.0.0.1.53437 > 127.0.0.1.31337: Flags [R.], seq 67, ack 870, win 6368, length 0
1768087469.693303 IP 127.0.0.1.53438 > 127.0.0.1.31337: Flags [R.], seq 159, ack 1035, win 6367, length 0
1768087470.844350 IP 127.0.0.1.53457 > 127.0.0.1.31337: Flags [F.], seq 75, ack 88, win 6380, options [nop,nop,TS val 4194830290 ecr 2612317088], length 0
1768087470.844407 IP 127.0.0.1.31337 > 127.0.0.1.53457: Flags [.], ack 76, win 6380, options [nop,nop,TS val 2612337092 ecr 4194830290], length 0
1768087470.984907 IP 127.0.0.1.53459 > 127.0.0.1.31337: Flags [S], seq 3605386639, win 65535, options [mss 16344,nop,wscale 6,nop,nop,TS val 526447439 ecr 0,sackOK,eol], length 0
1768087470.984990 IP 127.0.0.1.31337 > 127.0.0.1.53459: Flags [S.], seq 4079185541, ack 3605386640, win 65535, options [mss 16344,nop,wscale 6,nop,nop,TS val 3514512293 ecr 526447439,sackOK,eol], length 0
1768087470.985007 IP 127.0.0.1.53459 > 127.0.0.1.31337: Flags [.], ack 1, win 6380, options [nop,nop,TS val 526447440 ecr 3514512293], length 0
1768087470.985022 IP 127.0.0.1.31337 > 127.0.0.1.53459: Flags [.], ack 1, win 6380, options [nop,nop,TS val 3514512294 ecr 526447440], length 0
1768087470.985090 IP 127.0.0.1.53459 > 127.0.0.1.31337: Flags [P.], seq 1:5, ack 1, win 6380, options [nop,nop,TS val 526447440 ecr 3514512294], length 4
1768087470.985099 IP 127.0.0.1.53459 > 127.0.0.1.31337: Flags [P.], seq 5:18, ack 1, win 6380, options [nop,nop,TS val 526447440 ecr 3514512294], length 13
1768087470.985121 IP 127.0.0.1.31337 > 127.0.0.1.53459: Flags [.], ack 5, win 6380, options [nop,nop,TS val 3514512294 ecr 526447440], length 0
1768087470.985127 IP 127.0.0.1.31337 > 127.0.0.1.53459: Flags [.], ack 18, win 6380, options [nop,nop,TS val 3514512294 ecr 526447440], length 0
1768087471.123650 IP 127.0.0.1.31337 > 127.0.0.1.53459: Flags [P.], seq 1:12, ack 18, win 6380, options [nop,nop,TS val 3514512432 ecr 526447440], length 11
1768087471.123696 IP 127.0.0.1.53459 > 127.0.0.1.31337: Flags [.], ack 12, win 6380, options [nop,nop,TS val 526447578 ecr 3514512432], length 0
1768087471.123734 IP 127.0.0.1.53459 > 127.0.0.1.31337: Flags [P.], seq 18:22, ack 12, win 6380, options [nop,nop,TS val 526447578 ecr 3514512432], length 4
1768087471.123740 IP 127.0.0.1.53459 > 127.0.0.1.31337: Flags [P.], seq 22:35, ack 12, win 6380, options [nop,nop,TS val 526447578 ecr 3514512432], length 13
1768087471.123754 IP 127.0.0.1.31337 > 127.0.0.1.53459: Flags [.], ack 22, win 6380, options [nop,nop,TS val 3514512432 ecr 526447578], length 0
1768087471.123764 IP 127.0.0.1.31337 > 127.0.0.1.53459: Flags [.], ack 35, win 6380, options [nop,nop,TS val 3514512432 ecr 526447578], length 0
1768087471.186335 IP 127.0.0.1.31337 > 127.0.0.1.53459: Flags [P.], seq 12:36, ack 35, win 6380, options [nop,nop,TS val 3514512495 ecr 526447578], length 24
1768087471.186388 IP 127.0.0.1.53459 > 127.0.0.1.31337: Flags [.], ack 36, win 6380, options [nop,nop,TS val 526447641 ecr 3514512495], length 0
1768087471.186650 IP 127.0.0.1.53459 > 127.0.0.1.31337: Flags [P.], seq 35:39, ack 36, win 6380, options [nop,nop,TS val 526447641 ecr 3514512495], length 4
1768087471.186655 IP 127.0.0.1.53459 > 127.0.0.1.31337: Flags [P.], seq 39:58, ack 36, win 6380, options [nop,nop,TS val 526447641 ecr 3514512495], length 19
1768087471.186675 IP 127.0.0.1.31337 > 127.0.0.1.53459: Flags [.], ack 39, win 6380, options [nop,nop,TS val 3514512495 ecr 526447641], length 0
1768087471.186687 IP 127.0.0.1.31337 > 127.0.0.1.53459: Flags [.], ack 58, win 6380, options [nop,nop,TS val 3514512495 ecr 526447641], length 0
1768087471.277064 IP 127.0.0.1.31337 > 127.0.0.1.53459: Flags [P.], seq 36:859, ack 58, win 6380, options [nop,nop,TS val 3514512586 ecr 526447641], length 823
1768087471.277115 IP 127.0.0.1.53459 > 127.0.0.1.31337: Flags [.], ack 859, win 6368, options [nop,nop,TS val 526447732 ecr 3514512586], length 0
1768087471.277188 IP 127.0.0.1.53459 > 127.0.0.1.31337: Flags [P.], seq 58:62, ack 859, win 6368, options [nop,nop,TS val 526447732 ecr 3514512586], length 4
1768087471.277193 IP 127.0.0.1.53459 > 127.0.0.1.31337: Flags [P.], seq 62:66, ack 859, win 6368, options [nop,nop,TS val 526447732 ecr 3514512586], length 4
1768087471.277212 IP 127.0.0.1.31337 > 127.0.0.1.53459: Flags [.], ack 62, win 6380, options [nop,nop,TS val 3514512586 ecr 526447732], length 0
1768087471.277223 IP 127.0.0.1.31337 > 127.0.0.1.53459: Flags [.], ack 66, win 6380, options [nop,nop,TS val 3514512586 ecr 526447732], length 0
1768087471.339368 IP 127.0.0.1.31337 > 127.0.0.1.53459: Flags [P.], seq 859:870, ack 66, win 6380, options [nop,nop,TS val 3514512648 ecr 526447732], length 11
1768087471.339419 IP 127.0.0.1.53459 > 127.0.0.1.31337: Flags [.], ack 870, win 6368, options [nop,nop,TS val 526447794 ecr 3514512648], length 0
1768087471.339484 IP 127.0.0.1.53459 > 127.0.0.1.31337: Flags [F.], seq 66, ack 870, win 6368, options [nop,nop,TS val 526447794 ecr 3514512648], length 0
1768087471.339512 IP 127.0.0.1.31337 > 127.0.0.1.53459: Flags [.], ack 67, win 6380, options [nop,nop,TS val 3514512648 ecr 526447794], length 0
1768087471.431351 IP 127.0.0.1.31337 > 127.0.0.1.53459: Flags [F.], seq 870, ack 67, win 6380, options [nop,nop,TS val 3514512740 ecr 526447794], length 0
1768087471.431363 IP 127.0.0.1.31337 > 127.0.0.1.53457: Flags [F.], seq 88, ack 76, win 6380, options [nop,nop,TS val 2612337679 ecr 4194830290], length 0
1768087471.431369 IP 127.0.0.1.31337 > 127.0.0.1.53444: Flags [F.], seq 88, ack 70, win 6380, options [nop,nop,TS val 3187429387 ecr 2437015817], length 0
1768087471.431375 IP 127.0.0.1.31337 > 127.0.0.1.53440: Flags [F.], seq 88, ack 78, win 6380, options [nop,nop,TS val 2641338775 ecr 458015244], length 0
1768087471.431413 IP 127.0.0.1.53459 > 127.0.0.1.31337: Flags [.], ack 871, win 6368, options [nop,nop,TS val 526447886 ecr 3514512740], length 0
1768087471.431431 IP 127.0.0.1.53457 > 127.0.0.1.31337: Flags [.], ack 89, win 6380, options [nop,nop,TS val 4194830877 ecr 2612337679], length 0
1768087471.431443 IP 127.0.0.1.53444 > 127.0.0.1.31337: Flags [.], ack 89, win 6380, options [nop,nop,TS val 2437036793 ecr 3187429387], length 0
1768087471.431456 IP 127.0.0.1.53440 > 127.0.0.1.31337: Flags [.], ack 89, win 6380, options [nop,nop,TS val 458056598 ecr 2641338775], length 0
